[2025-03-11 23:28:03] [INFO] [AssetPool] Started initializing AssetPool
[2025-03-11 23:28:03] [INFO] [Engine] HEAP ALLOCATION INCREASED! 1.0 GB of 16.0 GB used
[2025-03-11 23:28:03] [INFO] [SpriteSheetOG] Started loading Sprite's from ./res/graphics
[2025-03-11 23:28:03] [INFO] [SpriteSheetOG] Finished reading files for sprites
[2025-03-11 23:28:04] [INFO] [Sprite] Finished loading ./res/graphics/misc/blue_reticle.png
[2025-03-11 23:28:04] [INFO] [Sprite] Finished loading ./res/graphics/misc/pink_spawn.png
[2025-03-11 23:28:04] [INFO] [Sprite] Finished loading ./res/graphics/misc/reticle.png
[2025-03-11 23:28:04] [INFO] [Sprite] Finished loading ./res/graphics/misc/yellow_spawn.png
[2025-03-11 23:28:04] [INFO] [Sprite] Finished loading ./res/graphics/misc/blue_spawn.png
[2025-03-11 23:28:04] [INFO] [Sprite] Finished loading ./res/graphics/misc/red_reticle.png
[2025-03-11 23:28:04] [INFO] [Sprite] Finished loading ./res/graphics/misc/depth_shadows.png
[2025-03-11 23:28:04] [INFO] [Sprite] Finished loading ./res/graphics/misc/yellow_reticle.png
[2025-03-11 23:28:04] [INFO] [Sprite] Finished loading ./res/graphics/misc/red_spawn.png
[2025-03-11 23:28:04] [INFO] [Sprite] Finished loading ./res/graphics/misc/directional_shadows.png
[2025-03-11 23:28:04] [INFO] [Sprite] Finished loading ./res/graphics/shadows/northwest.png
[2025-03-11 23:28:04] [INFO] [Sprite] Finished loading ./res/graphics/shadows/west.png
[2025-03-11 23:28:04] [INFO] [Sprite] Finished loading ./res/graphics/shadows/north.png
[2025-03-11 23:28:04] [INFO] [Sprite] Finished loading ./res/graphics/shadows/east.png
[2025-03-11 23:28:04] [INFO] [Sprite] Finished loading ./res/graphics/shadows/northeast.png
[2025-03-11 23:28:04] [INFO] [Sprite] Finished loading ./res/graphics/shadows/south.png
[2025-03-11 23:28:04] [INFO] [Sprite] Finished loading ./res/graphics/shadows/southwest.png
[2025-03-11 23:28:04] [INFO] [Sprite] Finished loading ./res/graphics/shadows/southeast.png
[2025-03-11 23:28:04] [INFO] [Sprite] Finished loading ./res/graphics/structures/tree3_structure.png
[2025-03-11 23:28:04] [INFO] [Sprite] Finished loading ./res/graphics/structures/tree4_structure.png
[2025-03-11 23:28:04] [INFO] [Sprite] Finished loading ./res/graphics/structures/tree1_structure.png
[2025-03-11 23:28:04] [INFO] [Sprite] Finished loading ./res/graphics/structures/tree5_structure.png
[2025-03-11 23:28:04] [INFO] [Sprite] Finished loading ./res/graphics/structures/tree2_structure.png
[2025-03-11 23:28:04] [INFO] [Sprite] Finished loading ./res/graphics/structures/tree6_structure.png
[2025-03-11 23:28:04] [INFO] [Sprite] Finished loading ./res/graphics/wall_tiles/rock_wall2.png
[2025-03-11 23:28:04] [INFO] [Sprite] Finished loading ./res/graphics/wall_tiles/sandstone_wall.png
[2025-03-11 23:28:04] [INFO] [Sprite] Finished loading ./res/graphics/wall_tiles/elden_yellow_wall.png
[2025-03-11 23:28:04] [INFO] [Sprite] Finished loading ./res/graphics/wall_tiles/vine_on_wall.png
[2025-03-11 23:28:04] [INFO] [Sprite] Finished loading ./res/graphics/wall_tiles/boulder_wall.png
[2025-03-11 23:28:04] [INFO] [Sprite] Finished loading ./res/graphics/wall_tiles/white_marble_wall.png
[2025-03-11 23:28:04] [INFO] [Sprite] Finished loading ./res/graphics/wall_tiles/elden_green_wall.png
[2025-03-11 23:28:04] [INFO] [Sprite] Finished loading ./res/graphics/wall_tiles/brown_marble_wall.png
[2025-03-11 23:28:04] [INFO] [Sprite] Finished loading ./res/graphics/wall_tiles/small_brick_wall.png
[2025-03-11 23:28:04] [INFO] [Sprite] Finished loading ./res/graphics/wall_tiles/moss_wall.png
[2025-03-11 23:28:04] [INFO] [Sprite] Finished loading ./res/graphics/wall_tiles/dirt_brick_vine_wall.png
[2025-03-11 23:28:04] [INFO] [Sprite] Finished loading ./res/graphics/wall_tiles/elden_purple_wall.png
[2025-03-11 23:28:04] [INFO] [Sprite] Finished loading ./res/graphics/wall_tiles/large_brick_wall.png
[2025-03-11 23:28:04] [INFO] [Sprite] Finished loading ./res/graphics/wall_tiles/dirt_wall.png
[2025-03-11 23:28:04] [INFO] [Sprite] Finished loading ./res/graphics/wall_tiles/alien_wall.png
[2025-03-11 23:28:04] [INFO] [Sprite] Finished loading ./res/graphics/wall_tiles/industrial_brick_wall.png
[2025-03-11 23:28:04] [INFO] [Sprite] Finished loading ./res/graphics/wall_tiles/rock_wall.png
[2025-03-11 23:28:04] [INFO] [Sprite] Finished loading ./res/graphics/wall_tiles/dirt_wall2.png
[2025-03-11 23:28:04] [INFO] [Sprite] Finished loading ./res/graphics/wall_tiles/moss_wall2.png
[2025-03-11 23:28:04] [INFO] [Sprite] Finished loading ./res/graphics/wall_tiles/moss_wall3.png
[2025-03-11 23:28:04] [INFO] [Sprite] Finished loading ./res/graphics/wall_tiles/no_wall.png
[2025-03-11 23:28:04] [INFO] [Sprite] Finished loading ./res/graphics/wall_tiles/alien_rune_wall.png
[2025-03-11 23:28:04] [INFO] [Sprite] Finished loading ./res/graphics/wall_tiles/industrial_wall.png
[2025-03-11 23:28:04] [INFO] [Sprite] Finished loading ./res/graphics/wall_tiles/small_brick_wall2.png
[2025-03-11 23:28:04] [INFO] [Sprite] Finished loading ./res/graphics/old/liquids 2.png
[2025-03-11 23:28:04] [INFO] [Sprite] Finished loading ./res/graphics/old/gems.png
[2025-03-11 23:28:04] [INFO] [Sprite] Finished loading ./res/graphics/old/floors.png
[2025-03-11 23:28:04] [INFO] [Sprite] Finished loading ./res/graphics/old/terrains.png
[2025-03-11 23:28:04] [INFO] [Sprite] Finished loading ./res/graphics/old/gemsRaw.png
[2025-03-11 23:28:04] [INFO] [Sprite] Finished loading ./res/graphics/old/walls.png
[2025-03-11 23:28:04] [INFO] [Sprite] Finished loading ./res/graphics/old/special2.png
[2025-03-11 23:28:04] [INFO] [Sprite] Finished loading ./res/graphics/old/structures.png
[2025-03-11 23:28:04] [INFO] [Sprite] Finished loading ./res/graphics/old/special.png
[2025-03-11 23:28:04] [INFO] [Sprite] Finished loading ./res/graphics/old/liquids.png
[2025-03-11 23:28:04] [INFO] [Sprite] Finished loading ./res/graphics/old/units.png
[2025-03-11 23:28:04] [INFO] [Sprite] Finished loading ./res/graphics/old/terrains2.png
[2025-03-11 23:28:04] [INFO] [Sprite] Finished loading ./res/graphics/old/floors2.png
[2025-03-11 23:28:04] [INFO] [Sprite] Finished loading ./res/graphics/floor_tiles/sand_1_floor.png
[2025-03-11 23:28:04] [INFO] [Sprite] Finished loading ./res/graphics/floor_tiles/sand_dark_floor.png
[2025-03-11 23:28:04] [INFO] [Sprite] Finished loading ./res/graphics/floor_tiles/dirty_grass_1_floor.png
[2025-03-11 23:28:04] [INFO] [Sprite] Finished loading ./res/graphics/floor_tiles/white_sand_floor.png
[2025-03-11 23:28:04] [INFO] [Sprite] Finished loading ./res/graphics/floor_tiles/white_sands_2.png
[2025-03-11 23:28:04] [INFO] [Sprite] Finished loading ./res/graphics/floor_tiles/dirty_grass_2_floor.png
[2025-03-11 23:28:04] [INFO] [Sprite] Finished loading ./res/graphics/floor_tiles/sand_3_floor.png
[2025-03-11 23:28:04] [INFO] [Sprite] Finished loading ./res/graphics/floor_tiles/obsidian_floor.png
[2025-03-11 23:28:04] [INFO] [Sprite] Finished loading ./res/graphics/floor_tiles/base_floor.png
[2025-03-11 23:28:04] [INFO] [Sprite] Finished loading ./res/graphics/floor_tiles/sand_floor.png
[2025-03-11 23:28:04] [INFO] [Sprite] Finished loading ./res/graphics/floor_tiles/dirty_grass_3_floor.png
[2025-03-11 23:28:04] [INFO] [Sprite] Finished loading ./res/graphics/floor_tiles/sand_2_floor.png
[2025-03-11 23:28:04] [INFO] [Sprite] Finished loading ./res/graphics/units/Air_Dragon.png
[2025-03-11 23:28:04] [INFO] [Sprite] Finished loading ./res/graphics/units/Dragon.png
[2025-03-11 23:28:04] [INFO] [Sprite] Finished loading ./res/graphics/units/Dark_Dragon.png
[2025-03-11 23:28:04] [INFO] [Sprite] Finished loading ./res/graphics/units/Earth_Dragon.png
[2025-03-11 23:28:04] [INFO] [Sprite] Finished loading ./res/graphics/units/Light_Dragon.png
[2025-03-11 23:28:04] [INFO] [Sprite] Finished loading ./res/graphics/units/Water_Dragon.png
[2025-03-11 23:28:04] [INFO] [Sprite] Finished loading ./res/graphics/units/Fire_Dragon.png
[2025-03-11 23:28:04] [INFO] [Sprite] Finished loading ./res/graphics/actions/StatsDown.png
[2025-03-11 23:28:04] [INFO] [Sprite] Finished loading ./res/graphics/actions/PhysicalHit4.png
[2025-03-11 23:28:04] [INFO] [Sprite] Finished loading ./res/graphics/actions/Slash.png
[2025-03-11 23:28:04] [INFO] [Sprite] Finished loading ./res/graphics/actions/Air.png
[2025-03-11 23:28:04] [INFO] [Sprite] Finished loading ./res/graphics/actions/Dark.png
[2025-03-11 23:28:04] [INFO] [Sprite] Finished loading ./res/graphics/actions/Blunt.png
[2025-03-11 23:28:04] [INFO] [Sprite] Finished loading ./res/graphics/actions/Fire.png
[2025-03-11 23:28:04] [INFO] [Sprite] Finished loading ./res/graphics/actions/Earth.png
[2025-03-11 23:28:04] [INFO] [Sprite] Finished loading ./res/graphics/actions/Light.png
[2025-03-11 23:28:04] [INFO] [Sprite] Finished loading ./res/graphics/actions/StatsUp.png
[2025-03-11 23:28:04] [INFO] [Sprite] Finished loading ./res/graphics/actions/Water.png
[2025-03-11 23:28:04] [INFO] [Sprite] Finished loading ./res/graphics/actions/Pierce.png
[2025-03-11 23:28:04] [INFO] [Sprite] Finished loading ./res/graphics/spells/LightSpell.png
[2025-03-11 23:28:04] [INFO] [Sprite] Finished loading ./res/graphics/spells/StatsDown.png
[2025-03-11 23:28:04] [INFO] [Sprite] Finished loading ./res/graphics/spells/WindSpell.png
[2025-03-11 23:28:04] [INFO] [Sprite] Finished loading ./res/graphics/spells/WaterSpell.png
[2025-03-11 23:28:04] [INFO] [Sprite] Finished loading ./res/graphics/spells/PhysicalHit4.png
[2025-03-11 23:28:04] [INFO] [Sprite] Finished loading ./res/graphics/spells/PhysicalHit1.png
[2025-03-11 23:28:04] [INFO] [Sprite] Finished loading ./res/graphics/spells/LightningSpell.png
[2025-03-11 23:28:04] [INFO] [Sprite] Finished loading ./res/graphics/spells/PhysicalHit3.png
[2025-03-11 23:28:04] [INFO] [Sprite] Finished loading ./res/graphics/spells/PhysicalHit2.png
[2025-03-11 23:28:04] [INFO] [Sprite] Finished loading ./res/graphics/spells/FireSpell.png
[2025-03-11 23:28:04] [INFO] [Sprite] Finished loading ./res/graphics/spells/DarkSpell.png
[2025-03-11 23:28:04] [INFO] [Sprite] Finished loading ./res/graphics/spells/StatsUp.png
[2025-03-11 23:28:04] [INFO] [Sprite] Finished loading ./res/graphics/spells/EarthSpell.png
[2025-03-11 23:28:04] [INFO] [Sprite] Finished loading ./res/graphics/liquids/greater_leafage_liquid.png
[2025-03-11 23:28:04] [INFO] [Sprite] Finished loading ./res/graphics/liquids/waterV4_liquid.png
[2025-03-11 23:28:04] [INFO] [Sprite] Finished loading ./res/graphics/liquids/shallow_swamp.png
[2025-03-11 23:28:04] [INFO] [Sprite] Finished loading ./res/graphics/liquids/water5.png
[2025-03-11 23:28:04] [INFO] [Sprite] Finished loading ./res/graphics/liquids/swamp_2.png
[2025-03-11 23:28:04] [INFO] [Sprite] Finished loading ./res/graphics/liquids/Lava_liquid.png
[2025-03-11 23:28:04] [INFO] [Sprite] Finished loading ./res/graphics/liquids/swamp2.png
[2025-03-11 23:28:04] [INFO] [Sprite] Finished loading ./res/graphics/liquids/waterV33_liquid.png
[2025-03-11 23:28:04] [INFO] [Sprite] Finished loading ./res/graphics/liquids/shallow_water_liquid.png
[2025-03-11 23:28:04] [INFO] [Sprite] Finished loading ./res/graphics/liquids/water_liquid.png
[2025-03-11 23:28:04] [INFO] [Sprite] Finished loading ./res/graphics/liquids/waterV2_liquid.png
[2025-03-11 23:28:04] [INFO] [Sprite] Finished loading ./res/graphics/liquids/swamp2_liquid.png
[2025-03-11 23:28:04] [INFO] [SpriteSheetOG] Finished loading ./res/graphics
[2025-03-11 23:28:04] [INFO] [AssetPool] Finished initializing AssetPool
[2025-03-11 23:28:04] [INFO] [FontPoolV1] Started initializing FontPoolV1
[2025-03-11 23:28:04] [INFO] [FontPoolV1] Finished initializing FontPoolV1
[2025-03-11 23:28:04] [INFO] [UnitDatabase] Started initializing UnitDatabase
[2025-03-11 23:28:04] [INFO] [UnitDatabase] Successfully initialized UnitDatabase
[2025-03-11 23:28:04] [INFO] [UnitDatabase] Finished initializing UnitDatabase
[2025-03-11 23:28:04] [INFO] [JsonDatabase] Started initializing JsonDatabase
[2025-03-11 23:28:04] [INFO] [JsonTable] Started initializing JsonTable
[2025-03-11 23:28:04] [INFO] [JsonTable] Successfully initialized JsonTable
[2025-03-11 23:28:04] [INFO] [JsonTable] Finished initializing JsonTable
[2025-03-11 23:28:04] [INFO] [JsonTable] Started initializing JsonTable
[2025-03-11 23:28:04] [INFO] [JsonTable] Successfully initialized JsonTable
[2025-03-11 23:28:04] [INFO] [JsonTable] Finished initializing JsonTable
[2025-03-11 23:28:04] [INFO] [JsonTable] Started initializing JsonTable
[2025-03-11 23:28:04] [INFO] [JsonTable] Successfully initialized JsonTable
[2025-03-11 23:28:04] [INFO] [JsonTable] Finished initializing JsonTable
[2025-03-11 23:28:04] [INFO] [JsonDatabase] Successfully initialized JsonDatabase
[2025-03-11 23:28:04] [INFO] [JsonDatabase] Finished initializing JsonDatabase
[2025-03-11 23:28:04] [INFO] [Component] Setting 334dfffd-b4a4-438b-99b9-0386a1b3ca80 on to 044bba05-d1a7-4d0d-a37f-a1f88653350b.
[2025-03-11 23:28:04] [INFO] [SpeedQueue] Added unit enemy:Eyce into queue
[2025-03-11 23:28:04] [INFO] [Component] Setting b278e493-d587-4b09-859f-37455d83976b on to 58e6a869-7304-4d3e-ba8a-c6d4127dca6a.
[2025-03-11 23:28:04] [INFO] [SpeedQueue] Added unit enemy:Hybhlp into queue
[2025-03-11 23:28:04] [INFO] [Component] Setting a2ad49e8-8cd4-431a-b366-936331cc98d5 on to 244b8ddd-b696-4d3a-90c2-5590a1c652aa.
[2025-03-11 23:28:04] [INFO] [SpeedQueue] Added unit enemy:Sofj into queue
[2025-03-11 23:28:04] [INFO] [Component] Setting 8bc79655-71f2-4169-bc35-e9e9c6706faf on to 2dc38d5f-4224-4029-ae05-7d587d82e36b.
[2025-03-11 23:28:04] [INFO] [SpeedQueue] Added unit enemy:Pyfav into queue
[2025-03-11 23:28:04] [INFO] [Component] Setting 65856f59-0065-4fea-8155-d4c6f6e211ee on to e8387956-d89c-40a3-9475-35a0ba547462.
[2025-03-11 23:28:04] [INFO] [SpeedQueue] Added unit user:Zytao into queue
[2025-03-11 23:28:04] [INFO] [Component] Setting 29d9d1c4-0abb-4575-ab3e-e80ac2ad8d58 on to 9f1c4b37-eb9b-4291-9a58-c06fd3c777d7.
[2025-03-11 23:28:04] [INFO] [SpeedQueue] Added unit user:Jokv into queue
[2025-03-11 23:28:04] [INFO] [Component] Setting 80274e99-c20d-4d12-be4e-ef66acffbe5e on to bd1e5265-7651-4583-8637-5ee16019c259.
[2025-03-11 23:28:04] [INFO] [SpeedQueue] Added unit user:Kirej into queue
[2025-03-11 23:28:04] [INFO] [FontPool] Started initializing FontPool
[2025-03-11 23:28:04] [INFO] [FontPool] ✅ Successfully loaded font: Lilian
[2025-03-11 23:28:05] [INFO] [SpeedQueue] Speed queue updated.
[2025-03-11 23:28:05] [INFO] [VisualsSystem] Started creating blurred background
[2025-03-11 23:28:05] [INFO] [TimeLinePanel] Started updating the timeline panel after turn order has changed.
[2025-03-11 23:28:05] [INFO] [TimeLinePanel] Finished updating the timeline panel after turn order has changed.
[2025-03-11 23:28:05] [INFO] [SelectedTilePanel] Checksum updated, getting units at selected tiles.
[2025-03-11 23:28:05] [INFO] [SelectedTilePanel] Either no unit selected or more than one unit selected
[2025-03-11 23:28:05] [INFO] [LesserStatisticsInformationPanel] Checksum has been updated, querying statistics for unit 29d9d1c4-0abb-4575-ab3e-e80ac2ad8d58
[2025-03-11 23:28:05] [INFO] [VisualsSystem] Finished creating blurred background after 0.4997765123844147 seconds
[2025-03-11 23:28:07] [INFO] [SelectedTilePanel] Checksum updated, getting units at selected tiles.
[2025-03-11 23:28:07] [INFO] [SelectedTilePanel] Updated selected tile display to view Pyfav
[2025-03-11 23:28:07] [INFO] [LesserStatisticsInformationPanel] Finished updating Greater UI
[2025-03-11 23:28:09] [INFO] [SelectedTilePanel] Checksum updated, getting units at selected tiles.
[2025-03-11 23:28:09] [INFO] [SelectedTilePanel] Updated selected tile display to view Jokv
[2025-03-11 23:28:09] [INFO] [LesserStatisticsInformationPanel] Finished updating Greater UI
[2025-03-11 23:28:12] [INFO] [MovementSystem] Jokv is planning to move from [6, 2] to [9, 6]
[2025-03-11 23:28:12] [INFO] [MovementSystem] Updated movement area for Jokv
[2025-03-11 23:28:12] [INFO] [MovementSystem] Updated movement path for Jokv
[2025-03-11 23:28:13] [INFO] [MovementSystem] Jokv is planning to move from [6, 2] to [9, 5]
[2025-03-11 23:28:13] [INFO] [MovementSystem] Updated movement path for Jokv
[2025-03-11 23:28:13] [INFO] [MovementSystem] Jokv is planning to move from [6, 2] to [9, 4]
[2025-03-11 23:28:13] [INFO] [MovementSystem] Updated movement path for Jokv
[2025-03-11 23:28:13] [INFO] [MovementSystem] Jokv is planning to move from [6, 2] to [8, 4]
[2025-03-11 23:28:13] [INFO] [MovementSystem] Updated movement path for Jokv
[2025-03-11 23:28:13] [INFO] [MovementSystem] Jokv is planning to move from [6, 2] to [8, 3]
[2025-03-11 23:28:13] [INFO] [MovementSystem] Updated movement path for Jokv
[2025-03-11 23:28:13] [INFO] [MovementSystem] Jokv is planning to move from [6, 2] to [7, 2]
[2025-03-11 23:28:13] [INFO] [MovementSystem] Updated movement path for Jokv
[2025-03-11 23:28:13] [INFO] [MovementSystem] Jokv is planning to move from [6, 2] to [8, 2]
[2025-03-11 23:28:13] [INFO] [MovementSystem] Updated movement path for Jokv
[2025-03-11 23:28:14] [INFO] [Component] Setting 29d9d1c4-0abb-4575-ab3e-e80ac2ad8d58 on to 6e414579-6436-4e1a-8b16-da52512e33a0.
[2025-03-11 23:28:14] [INFO] [MovementSystem] Moved from [6, 2] to [8, 2]
[2025-03-11 23:28:14] [INFO] [SelectedTilePanel] Checksum updated, getting units at selected tiles.
[2025-03-11 23:28:14] [INFO] [SelectedTilePanel] Updated selected tile display to view Jokv
[2025-03-11 23:28:14] [INFO] [LesserStatisticsInformationPanel] Finished updating Greater UI
[2025-03-11 23:28:17] [INFO] [AbilitySelectionPanel] Selecting energy_beam
[2025-03-11 23:28:17] [INFO] [AbilityDatabase] Started initializing AbilityDatabase
[2025-03-11 23:28:17] [INFO] [AbilityDatabase] Successfully initialized AbilityDatabase
[2025-03-11 23:28:17] [INFO] [AbilityDatabase] Finished initializing AbilityDatabase
[2025-03-11 23:28:17] [INFO] [AbilitySystem] Jokv is planning to use energy_beam on [9, 7]
[2025-03-11 23:28:17] [INFO] [AbilitySystem] Updated area of sight for Jokv, viewing 12 tiles
[2025-03-11 23:28:17] [INFO] [AbilitySystem] Updated line of sight for Jokv, viewing 7 tiles
[2025-03-11 23:28:17] [INFO] [AbilitySystem] Updated area of effect for Jokv viewing 1 tiles
[2025-03-11 23:28:17] [INFO] [AbilitySystem] Jokv is planning to use energy_beam on null
[2025-03-11 23:28:17] [INFO] [AbilitySystem] Updated line of sight for Jokv, viewing 0 tiles
[2025-03-11 23:28:17] [INFO] [AbilitySystem] Updated area of effect for Jokv viewing 0 tiles
[2025-03-11 23:28:17] [INFO] [AbilitySystem] Jokv is planning to use energy_beam on [9, 4]
[2025-03-11 23:28:17] [INFO] [AbilitySystem] Updated line of sight for Jokv, viewing 4 tiles
[2025-03-11 23:28:17] [INFO] [AbilitySystem] Updated area of effect for Jokv viewing 1 tiles
[2025-03-11 23:28:17] [INFO] [AbilitySystem] Jokv is planning to use energy_beam on [9, 3]
[2025-03-11 23:28:17] [INFO] [AbilitySystem] Updated line of sight for Jokv, viewing 3 tiles
[2025-03-11 23:28:17] [INFO] [AbilitySystem] Updated area of effect for Jokv viewing 1 tiles
[2025-03-11 23:28:17] [INFO] [AbilitySystem] Jokv is planning to use energy_beam on [9, 2]
[2025-03-11 23:28:17] [INFO] [AbilitySystem] Updated line of sight for Jokv, viewing 2 tiles
[2025-03-11 23:28:17] [INFO] [AbilitySystem] Updated area of effect for Jokv viewing 1 tiles
[2025-03-11 23:28:17] [INFO] [AbilitySystem] Jokv is planning to use energy_beam on [9, 1]
[2025-03-11 23:28:17] [INFO] [AbilitySystem] Updated line of sight for Jokv, viewing 3 tiles
[2025-03-11 23:28:17] [INFO] [AbilitySystem] Updated area of effect for Jokv viewing 1 tiles
[2025-03-11 23:28:17] [INFO] [AbilitySystem] Jokv is planning to use energy_beam on [9, 0]
[2025-03-11 23:28:17] [INFO] [AbilitySystem] Updated line of sight for Jokv, viewing 4 tiles
[2025-03-11 23:28:17] [INFO] [AbilitySystem] Updated area of effect for Jokv viewing 1 tiles
[2025-03-11 23:28:17] [INFO] [AbilitySystem] Jokv is planning to use energy_beam on [8, 0]
[2025-03-11 23:28:17] [INFO] [AbilitySystem] Updated line of sight for Jokv, viewing 3 tiles
[2025-03-11 23:28:17] [INFO] [AbilitySystem] Updated area of effect for Jokv viewing 1 tiles
[2025-03-11 23:28:18] [INFO] [AbilitySystem] Used from energy_beam on [8, 0]
[2025-03-11 23:28:19] [INFO] [SelectedTilePanel] Checksum updated, getting units at selected tiles.
[2025-03-11 23:28:19] [INFO] [SelectedTilePanel] Updated selected tile display to view Kirej
[2025-03-11 23:28:19] [INFO] [LesserStatisticsInformationPanel] Finished updating Greater UI
[2025-03-11 23:28:20] [INFO] [TimeLinePanel] Started updating the timeline panel after turn order has changed.
[2025-03-11 23:28:20] [INFO] [TimeLinePanel] Finished updating the timeline panel after turn order has changed.
[2025-03-11 23:28:20] [INFO] [MovementSystem] Hybhlp is planning to move from [9, 9] to [7, 9]
[2025-03-11 23:28:20] [INFO] [MovementSystem] Updated movement area for Hybhlp
[2025-03-11 23:28:20] [INFO] [MovementSystem] Updated movement path for Hybhlp
[2025-03-11 23:28:20] [INFO] [Component] Setting b278e493-d587-4b09-859f-37455d83976b on to 19bbab8d-b6f0-4cf1-aeb3-813fd768a4b3.
[2025-03-11 23:28:20] [INFO] [MovementSystem] Moved from [9, 9] to [7, 9]
[2025-03-11 23:28:24] [INFO] [TimeLinePanel] Started updating the timeline panel after turn order has changed.
[2025-03-11 23:28:24] [INFO] [TimeLinePanel] Finished updating the timeline panel after turn order has changed.
[2025-03-11 23:28:24] [INFO] [MovementSystem] Pyfav is planning to move from [2, 3] to [2, 4]
[2025-03-11 23:28:24] [INFO] [MovementSystem] Updated movement area for Pyfav
[2025-03-11 23:28:24] [INFO] [MovementSystem] Updated movement path for Pyfav
[2025-03-11 23:28:24] [INFO] [Component] Setting 8bc79655-71f2-4169-bc35-e9e9c6706faf on to 0b8fbf82-577c-4df3-aa76-06efff040882.
[2025-03-11 23:28:24] [INFO] [MovementSystem] Moved from [2, 3] to [2, 4]
[2025-03-11 23:28:26] [INFO] [Main] {
  "map.generation.zoom": 0.75,
  "map.generation.min.height": -10,
  "hovered.tiles": ["37456f89-b10f-41c9-9b7d-fce5b57bb652"],
  "view_sprite_height": 96,
  "delta_time": 0.017547333,
  "map.generation.starting.camerra.height": 950,
  "spawn.placement.policy": "everywhere",
  "gameplay.water.level": 0,
  "statistics.panel.is.open": false,
  "automatically.go.to.home.controls": false,
  "camera_map": {
    "main_camera": {},
    "selection_camera": {}
  },
  "map.generation.starting.y": 0,
  "map.generation.base.level": 1,
  "map.generation.starting.x": 0,
  "show.heights": true,
  "hide.gameplay.ui": true,
  "tile.to.glide.to": "",
  "map.generation.max.height": 10,
  "selected.tiles.checksum": 10473274,
  "map.generation.base.terrain": "dirty_grass_3_floor",
  "debug_mode_for_the_game_state": false,
  "movement.panel.is.open": false,
  "gameplay.rows": 10,
  "view_sprite_width": 96,
  "map.generation.starting.sprite.width": 96,
  "ability.panel.is.open": false,
  "gameplay.mode": "gameplay.mode.regular",
  "map.generation.structure.assets": ["tree4_structure"],
  "floating_text_map": {},
  "map.center.on.startup": true,
  "gameplay.columns": 10,
  "gameplay.water.asset": "water_liquid",
  "selected.tiles": ["bd1e5265-7651-4583-8637-5ee16019c259"],
  "map.generation.starting.camera.width": 1500,
  "should.end.the.turn": false,
  "selected_ability_from_ui": "",
  "map.generation.starting.sprite.height": 96,
  "map.generation.use.noise": true,
  "floating_text_font_size": 30,
  "map.generation.base.asset": "base_floor"
}
