[2025-03-15 11:03:28] [INFO] [AssetPool] Started initializing AssetPool
[2025-03-15 11:03:28] [INFO] [Engine] HEAP ALLOCATION INCREASED! 1.0 GB of 16.0 GB used
[2025-03-15 11:03:28] [INFO] [SpriteSheetOG] Started loading Sprite's from ./res/graphics
[2025-03-15 11:03:28] [INFO] [SpriteSheetOG] Finished reading files for sprites
[2025-03-15 11:03:28] [INFO] [Sprite] Finished loading ./res/graphics/misc/blue_reticle.png
[2025-03-15 11:03:28] [INFO] [Sprite] Finished loading ./res/graphics/misc/pink_spawn.png
[2025-03-15 11:03:28] [INFO] [Sprite] Finished loading ./res/graphics/misc/reticle.png
[2025-03-15 11:03:28] [INFO] [Sprite] Finished loading ./res/graphics/misc/yellow_spawn.png
[2025-03-15 11:03:28] [INFO] [Sprite] Finished loading ./res/graphics/misc/blue_spawn.png
[2025-03-15 11:03:28] [INFO] [Sprite] Finished loading ./res/graphics/misc/red_reticle.png
[2025-03-15 11:03:28] [INFO] [Sprite] Finished loading ./res/graphics/misc/depth_shadows.png
[2025-03-15 11:03:28] [INFO] [Sprite] Finished loading ./res/graphics/misc/yellow_reticle.png
[2025-03-15 11:03:28] [INFO] [Sprite] Finished loading ./res/graphics/misc/red_spawn.png
[2025-03-15 11:03:28] [INFO] [Sprite] Finished loading ./res/graphics/misc/directional_shadows.png
[2025-03-15 11:03:28] [INFO] [Sprite] Finished loading ./res/graphics/shadows/northwest.png
[2025-03-15 11:03:28] [INFO] [Sprite] Finished loading ./res/graphics/shadows/west.png
[2025-03-15 11:03:28] [INFO] [Sprite] Finished loading ./res/graphics/shadows/north.png
[2025-03-15 11:03:28] [INFO] [Sprite] Finished loading ./res/graphics/shadows/east.png
[2025-03-15 11:03:28] [INFO] [Sprite] Finished loading ./res/graphics/shadows/northeast.png
[2025-03-15 11:03:28] [INFO] [Sprite] Finished loading ./res/graphics/shadows/south.png
[2025-03-15 11:03:28] [INFO] [Sprite] Finished loading ./res/graphics/shadows/southwest.png
[2025-03-15 11:03:28] [INFO] [Sprite] Finished loading ./res/graphics/shadows/southeast.png
[2025-03-15 11:03:28] [INFO] [Sprite] Finished loading ./res/graphics/structures/tree3_structure.png
[2025-03-15 11:03:28] [INFO] [Sprite] Finished loading ./res/graphics/structures/tree4_structure.png
[2025-03-15 11:03:28] [INFO] [Sprite] Finished loading ./res/graphics/structures/tree1_structure.png
[2025-03-15 11:03:28] [INFO] [Sprite] Finished loading ./res/graphics/structures/tree5_structure.png
[2025-03-15 11:03:28] [INFO] [Sprite] Finished loading ./res/graphics/structures/tree2_structure.png
[2025-03-15 11:03:28] [INFO] [Sprite] Finished loading ./res/graphics/structures/tree6_structure.png
[2025-03-15 11:03:28] [INFO] [Sprite] Finished loading ./res/graphics/wall_tiles/rock_wall2.png
[2025-03-15 11:03:28] [INFO] [Sprite] Finished loading ./res/graphics/wall_tiles/sandstone_wall.png
[2025-03-15 11:03:28] [INFO] [Sprite] Finished loading ./res/graphics/wall_tiles/elden_yellow_wall.png
[2025-03-15 11:03:28] [INFO] [Sprite] Finished loading ./res/graphics/wall_tiles/vine_on_wall.png
[2025-03-15 11:03:28] [INFO] [Sprite] Finished loading ./res/graphics/wall_tiles/boulder_wall.png
[2025-03-15 11:03:28] [INFO] [Sprite] Finished loading ./res/graphics/wall_tiles/white_marble_wall.png
[2025-03-15 11:03:28] [INFO] [Sprite] Finished loading ./res/graphics/wall_tiles/elden_green_wall.png
[2025-03-15 11:03:28] [INFO] [Sprite] Finished loading ./res/graphics/wall_tiles/brown_marble_wall.png
[2025-03-15 11:03:28] [INFO] [Sprite] Finished loading ./res/graphics/wall_tiles/small_brick_wall.png
[2025-03-15 11:03:28] [INFO] [Sprite] Finished loading ./res/graphics/wall_tiles/moss_wall.png
[2025-03-15 11:03:28] [INFO] [Sprite] Finished loading ./res/graphics/wall_tiles/dirt_brick_vine_wall.png
[2025-03-15 11:03:28] [INFO] [Sprite] Finished loading ./res/graphics/wall_tiles/elden_purple_wall.png
[2025-03-15 11:03:28] [INFO] [Sprite] Finished loading ./res/graphics/wall_tiles/large_brick_wall.png
[2025-03-15 11:03:28] [INFO] [Sprite] Finished loading ./res/graphics/wall_tiles/dirt_wall.png
[2025-03-15 11:03:28] [INFO] [Sprite] Finished loading ./res/graphics/wall_tiles/alien_wall.png
[2025-03-15 11:03:28] [INFO] [Sprite] Finished loading ./res/graphics/wall_tiles/industrial_brick_wall.png
[2025-03-15 11:03:28] [INFO] [Sprite] Finished loading ./res/graphics/wall_tiles/rock_wall.png
[2025-03-15 11:03:28] [INFO] [Sprite] Finished loading ./res/graphics/wall_tiles/dirt_wall2.png
[2025-03-15 11:03:28] [INFO] [Sprite] Finished loading ./res/graphics/wall_tiles/moss_wall2.png
[2025-03-15 11:03:28] [INFO] [Sprite] Finished loading ./res/graphics/wall_tiles/moss_wall3.png
[2025-03-15 11:03:28] [INFO] [Sprite] Finished loading ./res/graphics/wall_tiles/no_wall.png
[2025-03-15 11:03:28] [INFO] [Sprite] Finished loading ./res/graphics/wall_tiles/alien_rune_wall.png
[2025-03-15 11:03:28] [INFO] [Sprite] Finished loading ./res/graphics/wall_tiles/industrial_wall.png
[2025-03-15 11:03:28] [INFO] [Sprite] Finished loading ./res/graphics/wall_tiles/small_brick_wall2.png
[2025-03-15 11:03:28] [INFO] [Sprite] Finished loading ./res/graphics/old/liquids 2.png
[2025-03-15 11:03:28] [INFO] [Sprite] Finished loading ./res/graphics/old/gems.png
[2025-03-15 11:03:28] [INFO] [Sprite] Finished loading ./res/graphics/old/floors.png
[2025-03-15 11:03:28] [INFO] [Sprite] Finished loading ./res/graphics/old/terrains.png
[2025-03-15 11:03:28] [INFO] [Sprite] Finished loading ./res/graphics/old/gemsRaw.png
[2025-03-15 11:03:28] [INFO] [Sprite] Finished loading ./res/graphics/old/walls.png
[2025-03-15 11:03:28] [INFO] [Sprite] Finished loading ./res/graphics/old/special2.png
[2025-03-15 11:03:28] [INFO] [Sprite] Finished loading ./res/graphics/old/structures.png
[2025-03-15 11:03:28] [INFO] [Sprite] Finished loading ./res/graphics/old/special.png
[2025-03-15 11:03:28] [INFO] [Sprite] Finished loading ./res/graphics/old/liquids.png
[2025-03-15 11:03:28] [INFO] [Sprite] Finished loading ./res/graphics/old/units.png
[2025-03-15 11:03:28] [INFO] [Sprite] Finished loading ./res/graphics/old/terrains2.png
[2025-03-15 11:03:28] [INFO] [Sprite] Finished loading ./res/graphics/old/floors2.png
[2025-03-15 11:03:28] [INFO] [Sprite] Finished loading ./res/graphics/floor_tiles/sand_1_floor.png
[2025-03-15 11:03:28] [INFO] [Sprite] Finished loading ./res/graphics/floor_tiles/sand_dark_floor.png
[2025-03-15 11:03:28] [INFO] [Sprite] Finished loading ./res/graphics/floor_tiles/dirty_grass_1_floor.png
[2025-03-15 11:03:28] [INFO] [Sprite] Finished loading ./res/graphics/floor_tiles/white_sand_floor.png
[2025-03-15 11:03:28] [INFO] [Sprite] Finished loading ./res/graphics/floor_tiles/white_sands_2.png
[2025-03-15 11:03:28] [INFO] [Sprite] Finished loading ./res/graphics/floor_tiles/dirty_grass_2_floor.png
[2025-03-15 11:03:28] [INFO] [Sprite] Finished loading ./res/graphics/floor_tiles/sand_3_floor.png
[2025-03-15 11:03:28] [INFO] [Sprite] Finished loading ./res/graphics/floor_tiles/obsidian_floor.png
[2025-03-15 11:03:28] [INFO] [Sprite] Finished loading ./res/graphics/floor_tiles/base_floor.png
[2025-03-15 11:03:28] [INFO] [Sprite] Finished loading ./res/graphics/floor_tiles/sand_floor.png
[2025-03-15 11:03:28] [INFO] [Sprite] Finished loading ./res/graphics/floor_tiles/dirty_grass_3_floor.png
[2025-03-15 11:03:28] [INFO] [Sprite] Finished loading ./res/graphics/floor_tiles/sand_2_floor.png
[2025-03-15 11:03:28] [INFO] [Sprite] Finished loading ./res/graphics/units/Air_Dragon.png
[2025-03-15 11:03:28] [INFO] [Sprite] Finished loading ./res/graphics/units/Dragon.png
[2025-03-15 11:03:28] [INFO] [Sprite] Finished loading ./res/graphics/units/Dark_Dragon.png
[2025-03-15 11:03:28] [INFO] [Sprite] Finished loading ./res/graphics/units/Earth_Dragon.png
[2025-03-15 11:03:28] [INFO] [Sprite] Finished loading ./res/graphics/units/Light_Dragon.png
[2025-03-15 11:03:28] [INFO] [Sprite] Finished loading ./res/graphics/units/Water_Dragon.png
[2025-03-15 11:03:28] [INFO] [Sprite] Finished loading ./res/graphics/units/Fire_Dragon.png
[2025-03-15 11:03:28] [INFO] [Sprite] Finished loading ./res/graphics/actions/StatsDown.png
[2025-03-15 11:03:28] [INFO] [Sprite] Finished loading ./res/graphics/actions/PhysicalHit4.png
[2025-03-15 11:03:28] [INFO] [Sprite] Finished loading ./res/graphics/actions/Slash.png
[2025-03-15 11:03:28] [INFO] [Sprite] Finished loading ./res/graphics/actions/Air.png
[2025-03-15 11:03:28] [INFO] [Sprite] Finished loading ./res/graphics/actions/Dark.png
[2025-03-15 11:03:28] [INFO] [Sprite] Finished loading ./res/graphics/actions/Blunt.png
[2025-03-15 11:03:28] [INFO] [Sprite] Finished loading ./res/graphics/actions/Fire.png
[2025-03-15 11:03:28] [INFO] [Sprite] Finished loading ./res/graphics/actions/Earth.png
[2025-03-15 11:03:28] [INFO] [Sprite] Finished loading ./res/graphics/actions/Light.png
[2025-03-15 11:03:28] [INFO] [Sprite] Finished loading ./res/graphics/actions/StatsUp.png
[2025-03-15 11:03:28] [INFO] [Sprite] Finished loading ./res/graphics/actions/Water.png
[2025-03-15 11:03:28] [INFO] [Sprite] Finished loading ./res/graphics/actions/Pierce.png
[2025-03-15 11:03:28] [INFO] [Sprite] Finished loading ./res/graphics/spells/LightSpell.png
[2025-03-15 11:03:28] [INFO] [Sprite] Finished loading ./res/graphics/spells/StatsDown.png
[2025-03-15 11:03:28] [INFO] [Sprite] Finished loading ./res/graphics/spells/WindSpell.png
[2025-03-15 11:03:28] [INFO] [Sprite] Finished loading ./res/graphics/spells/WaterSpell.png
[2025-03-15 11:03:28] [INFO] [Sprite] Finished loading ./res/graphics/spells/PhysicalHit4.png
[2025-03-15 11:03:28] [INFO] [Sprite] Finished loading ./res/graphics/spells/PhysicalHit1.png
[2025-03-15 11:03:28] [INFO] [Sprite] Finished loading ./res/graphics/spells/LightningSpell.png
[2025-03-15 11:03:28] [INFO] [Sprite] Finished loading ./res/graphics/spells/PhysicalHit3.png
[2025-03-15 11:03:28] [INFO] [Sprite] Finished loading ./res/graphics/spells/PhysicalHit2.png
[2025-03-15 11:03:28] [INFO] [Sprite] Finished loading ./res/graphics/spells/FireSpell.png
[2025-03-15 11:03:28] [INFO] [Sprite] Finished loading ./res/graphics/spells/DarkSpell.png
[2025-03-15 11:03:28] [INFO] [Sprite] Finished loading ./res/graphics/spells/StatsUp.png
[2025-03-15 11:03:28] [INFO] [Sprite] Finished loading ./res/graphics/spells/EarthSpell.png
[2025-03-15 11:03:28] [INFO] [Sprite] Finished loading ./res/graphics/liquids/greater_leafage_liquid.png
[2025-03-15 11:03:28] [INFO] [Sprite] Finished loading ./res/graphics/liquids/waterV4_liquid.png
[2025-03-15 11:03:28] [INFO] [Sprite] Finished loading ./res/graphics/liquids/shallow_swamp.png
[2025-03-15 11:03:28] [INFO] [Sprite] Finished loading ./res/graphics/liquids/water5.png
[2025-03-15 11:03:28] [INFO] [Sprite] Finished loading ./res/graphics/liquids/swamp_2.png
[2025-03-15 11:03:28] [INFO] [Sprite] Finished loading ./res/graphics/liquids/Lava_liquid.png
[2025-03-15 11:03:28] [INFO] [Sprite] Finished loading ./res/graphics/liquids/swamp2.png
[2025-03-15 11:03:28] [INFO] [Sprite] Finished loading ./res/graphics/liquids/waterV33_liquid.png
[2025-03-15 11:03:28] [INFO] [Sprite] Finished loading ./res/graphics/liquids/shallow_water_liquid.png
[2025-03-15 11:03:28] [INFO] [Sprite] Finished loading ./res/graphics/liquids/water_liquid.png
[2025-03-15 11:03:28] [INFO] [Sprite] Finished loading ./res/graphics/liquids/waterV2_liquid.png
[2025-03-15 11:03:28] [INFO] [Sprite] Finished loading ./res/graphics/liquids/swamp2_liquid.png
[2025-03-15 11:03:28] [INFO] [SpriteSheetOG] Finished loading ./res/graphics
[2025-03-15 11:03:28] [INFO] [AssetPool] Finished initializing AssetPool
[2025-03-15 11:03:29] [INFO] [FontPoolV1] Started initializing FontPoolV1
[2025-03-15 11:03:29] [INFO] [FontPoolV1] Finished initializing FontPoolV1
[2025-03-15 11:03:29] [INFO] [UnitDatabase] Started initializing UnitDatabase
[2025-03-15 11:03:29] [INFO] [UnitDatabase] Successfully initialized UnitDatabase
[2025-03-15 11:03:29] [INFO] [UnitDatabase] Finished initializing UnitDatabase
[2025-03-15 11:03:29] [INFO] [JsonDatabase] Started initializing JsonDatabase
[2025-03-15 11:03:29] [INFO] [JsonTable] Started initializing JsonTable
[2025-03-15 11:03:29] [INFO] [JsonTable] Successfully initialized JsonTable
[2025-03-15 11:03:29] [INFO] [JsonTable] Finished initializing JsonTable
[2025-03-15 11:03:29] [INFO] [JsonTable] Started initializing JsonTable
[2025-03-15 11:03:29] [INFO] [JsonTable] Successfully initialized JsonTable
[2025-03-15 11:03:29] [INFO] [JsonTable] Finished initializing JsonTable
[2025-03-15 11:03:29] [INFO] [JsonTable] Started initializing JsonTable
[2025-03-15 11:03:29] [INFO] [JsonTable] Successfully initialized JsonTable
[2025-03-15 11:03:29] [INFO] [JsonTable] Finished initializing JsonTable
[2025-03-15 11:03:29] [INFO] [JsonDatabase] Successfully initialized JsonDatabase
[2025-03-15 11:03:29] [INFO] [JsonDatabase] Finished initializing JsonDatabase
[2025-03-15 11:03:29] [INFO] [Component] Setting c7977ee3-24d7-40a7-9849-16a9be0594bc on to de891a4b-7159-444b-a044-45f178f59faa.
[2025-03-15 11:03:29] [INFO] [SpeedQueue] Added unit enemy:Vyfqu into queue
[2025-03-15 11:03:29] [INFO] [Component] Setting fe0244a0-b381-42c2-8e37-3070bc2928ff on to 19569cfc-18c8-49ce-8fb9-061bacb6f579.
[2025-03-15 11:03:29] [INFO] [SpeedQueue] Added unit enemy:Nokva into queue
[2025-03-15 11:03:29] [INFO] [Component] Setting 228518b6-ed51-4659-9099-17ef926abfe2 on to 6603c00c-0de8-40dc-aa73-a430da7499ae.
[2025-03-15 11:03:29] [INFO] [SpeedQueue] Added unit enemy:Guaaia into queue
[2025-03-15 11:03:29] [INFO] [Component] Setting 93f5f446-5f9d-4eae-be3c-0440f7a50fcb on to 4c073825-ee55-49ca-8649-ba6ce36e8f08.
[2025-03-15 11:03:29] [INFO] [SpeedQueue] Added unit user:Bygayo into queue
[2025-03-15 11:03:29] [INFO] [Component] Setting 8a642eaa-b8d9-4954-8265-0bf4c3e3dc55 on to 9213a31f-635a-4a04-8f2f-d400bc407157.
[2025-03-15 11:03:29] [INFO] [SpeedQueue] Added unit user:Rymo into queue
[2025-03-15 11:03:29] [INFO] [Component] Setting 56c2c4a0-47fc-469c-98fb-f8399d001e8e on to 44c3f0e5-0f75-43ec-b818-2eed218b86e0.
[2025-03-15 11:03:29] [INFO] [SpeedQueue] Added unit user:Lijuej into queue
[2025-03-15 11:03:29] [INFO] [FontPool] Started initializing FontPool
[2025-03-15 11:03:29] [INFO] [FontPool] ✅ Successfully loaded font: Lilian
[2025-03-15 11:03:30] [INFO] [SpeedQueue] Speed queue updated.
[2025-03-15 11:03:30] [INFO] [VisualsSystem] Started creating blurred background
[2025-03-15 11:03:30] [INFO] [TimeLinePanel] Started updating the timeline panel after turn order has changed.
[2025-03-15 11:03:30] [INFO] [TimeLinePanel] Finished updating the timeline panel after turn order has changed.
[2025-03-15 11:03:30] [INFO] [SelectedTilePanel] Checksum updated, getting units at selected tiles.
[2025-03-15 11:03:30] [INFO] [SelectedTilePanel] Either no unit selected or more than one unit selected
[2025-03-15 11:03:30] [INFO] [LesserStatisticsInformationPanel] Checksum has been updated, querying statistics for unit fe0244a0-b381-42c2-8e37-3070bc2928ff
[2025-03-15 11:03:30] [INFO] [VisualsSystem] Finished creating blurred background after 0.4996757209300995 seconds
[2025-03-15 11:03:31] [INFO] [AbilityDatabase] Started initializing AbilityDatabase
[2025-03-15 11:03:31] [INFO] [AbilityDatabase] Successfully initialized AbilityDatabase
[2025-03-15 11:03:31] [INFO] [AbilityDatabase] Finished initializing AbilityDatabase
[2025-03-15 11:03:32] [INFO] [SelectedTilePanel] Checksum updated, getting units at selected tiles.
[2025-03-15 11:03:32] [INFO] [SelectedTilePanel] Updated selected tile display to view Nokva
[2025-03-15 11:03:32] [INFO] [LesserStatisticsInformationPanel] Finished updating Greater UI
[2025-03-15 11:03:33] [INFO] [MovementSystem] Nokva is planning to move from [1, 8] to [2, 9]
[2025-03-15 11:03:33] [INFO] [MovementSystem] Updated movement area for Nokva
[2025-03-15 11:03:33] [INFO] [MovementSystem] Updated movement path for Nokva
[2025-03-15 11:03:33] [INFO] [Component] Setting fe0244a0-b381-42c2-8e37-3070bc2928ff on to dbfdddbd-93f4-4ab8-a6c2-d7cfc79f7b9c.
[2025-03-15 11:03:33] [INFO] [MovementSystem] Moved from [1, 8] to [2, 9]
[2025-03-15 11:03:35] [INFO] [TimeLinePanel] Started updating the timeline panel after turn order has changed.
[2025-03-15 11:03:35] [INFO] [TimeLinePanel] Finished updating the timeline panel after turn order has changed.
[2025-03-15 11:03:36] [INFO] [SelectedTilePanel] Checksum updated, getting units at selected tiles.
[2025-03-15 11:03:36] [INFO] [SelectedTilePanel] Updated selected tile display to view Vyfqu
[2025-03-15 11:03:36] [INFO] [LesserStatisticsInformationPanel] Finished updating Greater UI
[2025-03-15 11:03:37] [INFO] [MovementSystem] Vyfqu is planning to move from [0, 2] to [1, 1]
[2025-03-15 11:03:37] [INFO] [MovementSystem] Updated movement area for Vyfqu
[2025-03-15 11:03:37] [INFO] [MovementSystem] Updated movement path for Vyfqu
[2025-03-15 11:03:37] [INFO] [Component] Setting c7977ee3-24d7-40a7-9849-16a9be0594bc on to 32a33b40-8e40-4673-bd59-fc40bb0986ac.
[2025-03-15 11:03:37] [INFO] [MovementSystem] Moved from [0, 2] to [1, 1]
[2025-03-15 11:03:39] [INFO] [TimeLinePanel] Started updating the timeline panel after turn order has changed.
[2025-03-15 11:03:39] [INFO] [TimeLinePanel] Finished updating the timeline panel after turn order has changed.
[2025-03-15 11:03:39] [INFO] [MovementSystem] Rymo is planning to move from [3, 9] to null
[2025-03-15 11:03:39] [INFO] [MovementSystem] Updated movement area for Rymo
[2025-03-15 11:03:39] [INFO] [MovementSystem] Updated movement path for Rymo
[2025-03-15 11:03:40] [INFO] [SelectedTilePanel] Checksum updated, getting units at selected tiles.
[2025-03-15 11:03:40] [INFO] [SelectedTilePanel] Updated selected tile display to view Rymo
[2025-03-15 11:03:40] [INFO] [LesserStatisticsInformationPanel] Finished updating Greater UI
[2025-03-15 11:03:40] [INFO] [MovementSystem] Rymo is planning to move from [3, 9] to [0, 1]
[2025-03-15 11:03:40] [INFO] [MovementSystem] Updated movement path for Rymo
[2025-03-15 11:03:40] [INFO] [MovementSystem] Rymo is planning to move from [3, 9] to [0, 3]
[2025-03-15 11:03:40] [INFO] [MovementSystem] Updated movement path for Rymo
[2025-03-15 11:03:40] [INFO] [MovementSystem] Rymo is planning to move from [3, 9] to [0, 4]
[2025-03-15 11:03:40] [INFO] [MovementSystem] Updated movement path for Rymo
[2025-03-15 11:03:40] [INFO] [MovementSystem] Rymo is planning to move from [3, 9] to [0, 6]
[2025-03-15 11:03:40] [INFO] [MovementSystem] Updated movement path for Rymo
[2025-03-15 11:03:41] [INFO] [MovementSystem] Rymo is planning to move from [3, 9] to [0, 7]
[2025-03-15 11:03:41] [INFO] [MovementSystem] Updated movement path for Rymo
[2025-03-15 11:03:41] [INFO] [MovementSystem] Rymo is planning to move from [3, 9] to [1, 8]
[2025-03-15 11:03:41] [INFO] [MovementSystem] Updated movement path for Rymo
[2025-03-15 11:03:41] [INFO] [MovementSystem] Rymo is planning to move from [3, 9] to [2, 9]
[2025-03-15 11:03:41] [INFO] [MovementSystem] Updated movement path for Rymo
[2025-03-15 11:03:41] [INFO] [MovementSystem] Rymo is planning to move from [3, 9] to null
[2025-03-15 11:03:41] [INFO] [MovementSystem] Updated movement path for Rymo
[2025-03-15 11:03:41] [INFO] [MovementSystem] Rymo is planning to move from [3, 9] to [4, 9]
[2025-03-15 11:03:41] [INFO] [MovementSystem] Updated movement path for Rymo
[2025-03-15 11:03:41] [INFO] [MovementSystem] Rymo is planning to move from [3, 9] to [4, 8]
[2025-03-15 11:03:41] [INFO] [MovementSystem] Updated movement path for Rymo
[2025-03-15 11:03:41] [INFO] [MovementSystem] Rymo is planning to move from [3, 9] to [3, 8]
[2025-03-15 11:03:41] [INFO] [MovementSystem] Updated movement path for Rymo
[2025-03-15 11:03:42] [INFO] [MovementSystem] Rymo is planning to move from [3, 9] to [2, 8]
[2025-03-15 11:03:42] [INFO] [MovementSystem] Updated movement path for Rymo
[2025-03-15 11:03:42] [INFO] [Component] Setting 8a642eaa-b8d9-4954-8265-0bf4c3e3dc55 on to e419dc23-9560-4091-a497-134de8f72ee6.
[2025-03-15 11:03:42] [INFO] [MovementSystem] Moved from [3, 9] to [2, 8]
[2025-03-15 11:03:42] [INFO] [SelectedTilePanel] Checksum updated, getting units at selected tiles.
[2025-03-15 11:03:42] [INFO] [SelectedTilePanel] Updated selected tile display to view Rymo
[2025-03-15 11:03:42] [INFO] [LesserStatisticsInformationPanel] Finished updating Greater UI
[2025-03-15 11:03:46] [INFO] [AbilitySelectionPanel] Selecting energy_beam
[2025-03-15 11:03:46] [INFO] [AbilitySystem] Rymo is planning to use energy_beam on null
[2025-03-15 11:03:46] [INFO] [AbilitySystem] Updated area of sight for Rymo, viewing 12 tiles
[2025-03-15 11:03:46] [INFO] [AbilitySystem] Updated line of sight for Rymo, viewing 0 tiles
[2025-03-15 11:03:46] [INFO] [AbilitySystem] Updated area of effect for Rymo viewing 0 tiles
[2025-03-15 11:03:46] [INFO] [AbilitySystem] Rymo is planning to use energy_beam on [2, 9]
[2025-03-15 11:03:46] [INFO] [AbilitySystem] Updated line of sight for Rymo, viewing 2 tiles
[2025-03-15 11:03:46] [INFO] [AbilitySystem] Updated area of effect for Rymo viewing 1 tiles
[2025-03-15 11:03:47] [INFO] [AbilitySystem] Rymo is planning to use energy_beam on [1, 9]
[2025-03-15 11:03:47] [INFO] [AbilitySystem] Updated line of sight for Rymo, viewing 3 tiles
[2025-03-15 11:03:47] [INFO] [AbilitySystem] Updated area of effect for Rymo viewing 1 tiles
[2025-03-15 11:03:47] [INFO] [AbilitySystem] Rymo is planning to use energy_beam on [1, 8]
[2025-03-15 11:03:47] [INFO] [AbilitySystem] Updated line of sight for Rymo, viewing 2 tiles
[2025-03-15 11:03:47] [INFO] [AbilitySystem] Updated area of effect for Rymo viewing 1 tiles
[2025-03-15 11:03:48] [INFO] [AbilitySystem] Rymo is planning to use energy_beam on [1, 9]
[2025-03-15 11:03:48] [INFO] [AbilitySystem] Updated line of sight for Rymo, viewing 3 tiles
[2025-03-15 11:03:48] [INFO] [AbilitySystem] Updated area of effect for Rymo viewing 1 tiles
[2025-03-15 11:03:48] [INFO] [AbilitySystem] Rymo is planning to use energy_beam on [2, 9]
[2025-03-15 11:03:48] [INFO] [AbilitySystem] Updated line of sight for Rymo, viewing 2 tiles
[2025-03-15 11:03:48] [INFO] [AbilitySystem] Updated area of effect for Rymo viewing 1 tiles
[2025-03-15 11:03:50] [INFO] [AbilitySystem] Used from energy_beam on [2, 9]
[2025-03-15 11:03:52] [INFO] [TimeLinePanel] Started updating the timeline panel after turn order has changed.
[2025-03-15 11:03:52] [INFO] [TimeLinePanel] Finished updating the timeline panel after turn order has changed.
[2025-03-15 11:03:52] [INFO] [MovementSystem] Guaaia is planning to move from [6, 5] to [5, 5]
[2025-03-15 11:03:52] [INFO] [MovementSystem] Updated movement area for Guaaia
[2025-03-15 11:03:52] [INFO] [MovementSystem] Updated movement path for Guaaia
[2025-03-15 11:03:52] [INFO] [Component] Setting 228518b6-ed51-4659-9099-17ef926abfe2 on to 40c14878-fcff-4435-a796-8f5188f599a4.
[2025-03-15 11:03:52] [INFO] [MovementSystem] Moved from [6, 5] to [5, 5]
[2025-03-15 11:03:56] [INFO] [TimeLinePanel] Started updating the timeline panel after turn order has changed.
[2025-03-15 11:03:56] [INFO] [TimeLinePanel] Finished updating the timeline panel after turn order has changed.
[2025-03-15 11:04:14] [INFO] [Main] {
  "map.generation.zoom": 0.75,
  "map.generation.min.height": -10,
  "hovered.tiles": ["4e74d2dc-cfc1-4643-89c9-db89975920c1"],
  "view_sprite_height": 96,
  "delta_time": 0.016673917,
  "map.generation.starting.camerra.height": 950,
  "spawn.placement.policy": "everywhere",
  "gameplay.water.level": 0,
  "statistics.panel.is.open": false,
  "automatically.go.to.home.controls": false,
  "camera_map": {
    "main_camera": {},
    "selection_camera": {}
  },
  "map.generation.starting.y": 0,
  "map.generation.base.level": 1,
  "map.generation.starting.x": 0,
  "show.heights": true,
  "hide.gameplay.ui": true,
  "tile.to.glide.to": "",
  "map.generation.max.height": 10,
  "selected.tiles.checksum": 23623303,
  "map.generation.base.terrain": "obsidian_floor",
  "debug_mode_for_the_game_state": false,
  "movement.panel.is.open": false,
  "gameplay.rows": 10,
  "view_sprite_width": 96,
  "map.generation.starting.sprite.width": 96,
  "ability.panel.is.open": false,
  "gameplay.mode": "gameplay.mode.regular",
  "map.generation.structure.assets": ["tree4_structure"],
  "floating_text_map": {},
  "map.center.on.startup": true,
  "gameplay.columns": 10,
  "gameplay.water.asset": "water_liquid",
  "selected.tiles": ["e419dc23-9560-4091-a497-134de8f72ee6"],
  "map.generation.starting.camera.width": 1500,
  "should.end.the.turn": false,
  "selected_ability_from_ui": "",
  "map.generation.starting.sprite.height": 96,
  "map.generation.use.noise": true,
  "floating_text_font_size": 30,
  "map.generation.base.asset": "base_floor"
}
