[2025-03-12 00:05:19] [INFO] [AssetPool] Started initializing AssetPool
[2025-03-12 00:05:19] [INFO] [Engine] HEAP ALLOCATION INCREASED! 1.0 GB of 16.0 GB used
[2025-03-12 00:05:19] [INFO] [SpriteSheetOG] Started loading Sprite's from ./res/graphics
[2025-03-12 00:05:19] [INFO] [SpriteSheetOG] Finished reading files for sprites
[2025-03-12 00:05:19] [INFO] [Sprite] Finished loading ./res/graphics/misc/blue_reticle.png
[2025-03-12 00:05:19] [INFO] [Sprite] Finished loading ./res/graphics/misc/pink_spawn.png
[2025-03-12 00:05:19] [INFO] [Sprite] Finished loading ./res/graphics/misc/reticle.png
[2025-03-12 00:05:19] [INFO] [Sprite] Finished loading ./res/graphics/misc/yellow_spawn.png
[2025-03-12 00:05:19] [INFO] [Sprite] Finished loading ./res/graphics/misc/blue_spawn.png
[2025-03-12 00:05:19] [INFO] [Sprite] Finished loading ./res/graphics/misc/red_reticle.png
[2025-03-12 00:05:19] [INFO] [Sprite] Finished loading ./res/graphics/misc/depth_shadows.png
[2025-03-12 00:05:19] [INFO] [Sprite] Finished loading ./res/graphics/misc/yellow_reticle.png
[2025-03-12 00:05:19] [INFO] [Sprite] Finished loading ./res/graphics/misc/red_spawn.png
[2025-03-12 00:05:19] [INFO] [Sprite] Finished loading ./res/graphics/misc/directional_shadows.png
[2025-03-12 00:05:19] [INFO] [Sprite] Finished loading ./res/graphics/shadows/northwest.png
[2025-03-12 00:05:19] [INFO] [Sprite] Finished loading ./res/graphics/shadows/west.png
[2025-03-12 00:05:19] [INFO] [Sprite] Finished loading ./res/graphics/shadows/north.png
[2025-03-12 00:05:19] [INFO] [Sprite] Finished loading ./res/graphics/shadows/east.png
[2025-03-12 00:05:19] [INFO] [Sprite] Finished loading ./res/graphics/shadows/northeast.png
[2025-03-12 00:05:19] [INFO] [Sprite] Finished loading ./res/graphics/shadows/south.png
[2025-03-12 00:05:19] [INFO] [Sprite] Finished loading ./res/graphics/shadows/southwest.png
[2025-03-12 00:05:19] [INFO] [Sprite] Finished loading ./res/graphics/shadows/southeast.png
[2025-03-12 00:05:19] [INFO] [Sprite] Finished loading ./res/graphics/structures/tree3_structure.png
[2025-03-12 00:05:19] [INFO] [Sprite] Finished loading ./res/graphics/structures/tree4_structure.png
[2025-03-12 00:05:19] [INFO] [Sprite] Finished loading ./res/graphics/structures/tree1_structure.png
[2025-03-12 00:05:19] [INFO] [Sprite] Finished loading ./res/graphics/structures/tree5_structure.png
[2025-03-12 00:05:19] [INFO] [Sprite] Finished loading ./res/graphics/structures/tree2_structure.png
[2025-03-12 00:05:19] [INFO] [Sprite] Finished loading ./res/graphics/structures/tree6_structure.png
[2025-03-12 00:05:19] [INFO] [Sprite] Finished loading ./res/graphics/wall_tiles/rock_wall2.png
[2025-03-12 00:05:19] [INFO] [Sprite] Finished loading ./res/graphics/wall_tiles/sandstone_wall.png
[2025-03-12 00:05:19] [INFO] [Sprite] Finished loading ./res/graphics/wall_tiles/elden_yellow_wall.png
[2025-03-12 00:05:19] [INFO] [Sprite] Finished loading ./res/graphics/wall_tiles/vine_on_wall.png
[2025-03-12 00:05:19] [INFO] [Sprite] Finished loading ./res/graphics/wall_tiles/boulder_wall.png
[2025-03-12 00:05:19] [INFO] [Sprite] Finished loading ./res/graphics/wall_tiles/white_marble_wall.png
[2025-03-12 00:05:19] [INFO] [Sprite] Finished loading ./res/graphics/wall_tiles/elden_green_wall.png
[2025-03-12 00:05:19] [INFO] [Sprite] Finished loading ./res/graphics/wall_tiles/brown_marble_wall.png
[2025-03-12 00:05:19] [INFO] [Sprite] Finished loading ./res/graphics/wall_tiles/small_brick_wall.png
[2025-03-12 00:05:19] [INFO] [Sprite] Finished loading ./res/graphics/wall_tiles/moss_wall.png
[2025-03-12 00:05:19] [INFO] [Sprite] Finished loading ./res/graphics/wall_tiles/dirt_brick_vine_wall.png
[2025-03-12 00:05:19] [INFO] [Sprite] Finished loading ./res/graphics/wall_tiles/elden_purple_wall.png
[2025-03-12 00:05:19] [INFO] [Sprite] Finished loading ./res/graphics/wall_tiles/large_brick_wall.png
[2025-03-12 00:05:19] [INFO] [Sprite] Finished loading ./res/graphics/wall_tiles/dirt_wall.png
[2025-03-12 00:05:19] [INFO] [Sprite] Finished loading ./res/graphics/wall_tiles/alien_wall.png
[2025-03-12 00:05:19] [INFO] [Sprite] Finished loading ./res/graphics/wall_tiles/industrial_brick_wall.png
[2025-03-12 00:05:19] [INFO] [Sprite] Finished loading ./res/graphics/wall_tiles/rock_wall.png
[2025-03-12 00:05:19] [INFO] [Sprite] Finished loading ./res/graphics/wall_tiles/dirt_wall2.png
[2025-03-12 00:05:19] [INFO] [Sprite] Finished loading ./res/graphics/wall_tiles/moss_wall2.png
[2025-03-12 00:05:19] [INFO] [Sprite] Finished loading ./res/graphics/wall_tiles/moss_wall3.png
[2025-03-12 00:05:19] [INFO] [Sprite] Finished loading ./res/graphics/wall_tiles/no_wall.png
[2025-03-12 00:05:19] [INFO] [Sprite] Finished loading ./res/graphics/wall_tiles/alien_rune_wall.png
[2025-03-12 00:05:19] [INFO] [Sprite] Finished loading ./res/graphics/wall_tiles/industrial_wall.png
[2025-03-12 00:05:19] [INFO] [Sprite] Finished loading ./res/graphics/wall_tiles/small_brick_wall2.png
[2025-03-12 00:05:19] [INFO] [Sprite] Finished loading ./res/graphics/old/liquids 2.png
[2025-03-12 00:05:19] [INFO] [Sprite] Finished loading ./res/graphics/old/gems.png
[2025-03-12 00:05:19] [INFO] [Sprite] Finished loading ./res/graphics/old/floors.png
[2025-03-12 00:05:19] [INFO] [Sprite] Finished loading ./res/graphics/old/terrains.png
[2025-03-12 00:05:19] [INFO] [Sprite] Finished loading ./res/graphics/old/gemsRaw.png
[2025-03-12 00:05:19] [INFO] [Sprite] Finished loading ./res/graphics/old/walls.png
[2025-03-12 00:05:19] [INFO] [Sprite] Finished loading ./res/graphics/old/special2.png
[2025-03-12 00:05:19] [INFO] [Sprite] Finished loading ./res/graphics/old/structures.png
[2025-03-12 00:05:19] [INFO] [Sprite] Finished loading ./res/graphics/old/special.png
[2025-03-12 00:05:19] [INFO] [Sprite] Finished loading ./res/graphics/old/liquids.png
[2025-03-12 00:05:19] [INFO] [Sprite] Finished loading ./res/graphics/old/units.png
[2025-03-12 00:05:20] [INFO] [Sprite] Finished loading ./res/graphics/old/terrains2.png
[2025-03-12 00:05:20] [INFO] [Sprite] Finished loading ./res/graphics/old/floors2.png
[2025-03-12 00:05:20] [INFO] [Sprite] Finished loading ./res/graphics/floor_tiles/sand_1_floor.png
[2025-03-12 00:05:20] [INFO] [Sprite] Finished loading ./res/graphics/floor_tiles/sand_dark_floor.png
[2025-03-12 00:05:20] [INFO] [Sprite] Finished loading ./res/graphics/floor_tiles/dirty_grass_1_floor.png
[2025-03-12 00:05:20] [INFO] [Sprite] Finished loading ./res/graphics/floor_tiles/white_sand_floor.png
[2025-03-12 00:05:20] [INFO] [Sprite] Finished loading ./res/graphics/floor_tiles/white_sands_2.png
[2025-03-12 00:05:20] [INFO] [Sprite] Finished loading ./res/graphics/floor_tiles/dirty_grass_2_floor.png
[2025-03-12 00:05:20] [INFO] [Sprite] Finished loading ./res/graphics/floor_tiles/sand_3_floor.png
[2025-03-12 00:05:20] [INFO] [Sprite] Finished loading ./res/graphics/floor_tiles/obsidian_floor.png
[2025-03-12 00:05:20] [INFO] [Sprite] Finished loading ./res/graphics/floor_tiles/base_floor.png
[2025-03-12 00:05:20] [INFO] [Sprite] Finished loading ./res/graphics/floor_tiles/sand_floor.png
[2025-03-12 00:05:20] [INFO] [Sprite] Finished loading ./res/graphics/floor_tiles/dirty_grass_3_floor.png
[2025-03-12 00:05:20] [INFO] [Sprite] Finished loading ./res/graphics/floor_tiles/sand_2_floor.png
[2025-03-12 00:05:20] [INFO] [Sprite] Finished loading ./res/graphics/units/Air_Dragon.png
[2025-03-12 00:05:20] [INFO] [Sprite] Finished loading ./res/graphics/units/Dragon.png
[2025-03-12 00:05:20] [INFO] [Sprite] Finished loading ./res/graphics/units/Dark_Dragon.png
[2025-03-12 00:05:20] [INFO] [Sprite] Finished loading ./res/graphics/units/Earth_Dragon.png
[2025-03-12 00:05:20] [INFO] [Sprite] Finished loading ./res/graphics/units/Light_Dragon.png
[2025-03-12 00:05:20] [INFO] [Sprite] Finished loading ./res/graphics/units/Water_Dragon.png
[2025-03-12 00:05:20] [INFO] [Sprite] Finished loading ./res/graphics/units/Fire_Dragon.png
[2025-03-12 00:05:20] [INFO] [Sprite] Finished loading ./res/graphics/actions/StatsDown.png
[2025-03-12 00:05:20] [INFO] [Sprite] Finished loading ./res/graphics/actions/PhysicalHit4.png
[2025-03-12 00:05:20] [INFO] [Sprite] Finished loading ./res/graphics/actions/Slash.png
[2025-03-12 00:05:20] [INFO] [Sprite] Finished loading ./res/graphics/actions/Air.png
[2025-03-12 00:05:20] [INFO] [Sprite] Finished loading ./res/graphics/actions/Dark.png
[2025-03-12 00:05:20] [INFO] [Sprite] Finished loading ./res/graphics/actions/Blunt.png
[2025-03-12 00:05:20] [INFO] [Sprite] Finished loading ./res/graphics/actions/Fire.png
[2025-03-12 00:05:20] [INFO] [Sprite] Finished loading ./res/graphics/actions/Earth.png
[2025-03-12 00:05:20] [INFO] [Sprite] Finished loading ./res/graphics/actions/Light.png
[2025-03-12 00:05:20] [INFO] [Sprite] Finished loading ./res/graphics/actions/StatsUp.png
[2025-03-12 00:05:20] [INFO] [Sprite] Finished loading ./res/graphics/actions/Water.png
[2025-03-12 00:05:20] [INFO] [Sprite] Finished loading ./res/graphics/actions/Pierce.png
[2025-03-12 00:05:20] [INFO] [Sprite] Finished loading ./res/graphics/spells/LightSpell.png
[2025-03-12 00:05:20] [INFO] [Sprite] Finished loading ./res/graphics/spells/StatsDown.png
[2025-03-12 00:05:20] [INFO] [Sprite] Finished loading ./res/graphics/spells/WindSpell.png
[2025-03-12 00:05:20] [INFO] [Sprite] Finished loading ./res/graphics/spells/WaterSpell.png
[2025-03-12 00:05:20] [INFO] [Sprite] Finished loading ./res/graphics/spells/PhysicalHit4.png
[2025-03-12 00:05:20] [INFO] [Sprite] Finished loading ./res/graphics/spells/PhysicalHit1.png
[2025-03-12 00:05:20] [INFO] [Sprite] Finished loading ./res/graphics/spells/LightningSpell.png
[2025-03-12 00:05:20] [INFO] [Sprite] Finished loading ./res/graphics/spells/PhysicalHit3.png
[2025-03-12 00:05:20] [INFO] [Sprite] Finished loading ./res/graphics/spells/PhysicalHit2.png
[2025-03-12 00:05:20] [INFO] [Sprite] Finished loading ./res/graphics/spells/FireSpell.png
[2025-03-12 00:05:20] [INFO] [Sprite] Finished loading ./res/graphics/spells/DarkSpell.png
[2025-03-12 00:05:20] [INFO] [Sprite] Finished loading ./res/graphics/spells/StatsUp.png
[2025-03-12 00:05:20] [INFO] [Sprite] Finished loading ./res/graphics/spells/EarthSpell.png
[2025-03-12 00:05:20] [INFO] [Sprite] Finished loading ./res/graphics/liquids/greater_leafage_liquid.png
[2025-03-12 00:05:20] [INFO] [Sprite] Finished loading ./res/graphics/liquids/waterV4_liquid.png
[2025-03-12 00:05:20] [INFO] [Sprite] Finished loading ./res/graphics/liquids/shallow_swamp.png
[2025-03-12 00:05:20] [INFO] [Sprite] Finished loading ./res/graphics/liquids/water5.png
[2025-03-12 00:05:20] [INFO] [Sprite] Finished loading ./res/graphics/liquids/swamp_2.png
[2025-03-12 00:05:20] [INFO] [Sprite] Finished loading ./res/graphics/liquids/Lava_liquid.png
[2025-03-12 00:05:20] [INFO] [Sprite] Finished loading ./res/graphics/liquids/swamp2.png
[2025-03-12 00:05:20] [INFO] [Sprite] Finished loading ./res/graphics/liquids/waterV33_liquid.png
[2025-03-12 00:05:20] [INFO] [Sprite] Finished loading ./res/graphics/liquids/shallow_water_liquid.png
[2025-03-12 00:05:20] [INFO] [Sprite] Finished loading ./res/graphics/liquids/water_liquid.png
[2025-03-12 00:05:20] [INFO] [Sprite] Finished loading ./res/graphics/liquids/waterV2_liquid.png
[2025-03-12 00:05:20] [INFO] [Sprite] Finished loading ./res/graphics/liquids/swamp2_liquid.png
[2025-03-12 00:05:20] [INFO] [SpriteSheetOG] Finished loading ./res/graphics
[2025-03-12 00:05:20] [INFO] [AssetPool] Finished initializing AssetPool
[2025-03-12 00:05:20] [INFO] [FontPoolV1] Started initializing FontPoolV1
[2025-03-12 00:05:20] [INFO] [FontPoolV1] Finished initializing FontPoolV1
[2025-03-12 00:05:20] [INFO] [UnitDatabase] Started initializing UnitDatabase
[2025-03-12 00:05:20] [INFO] [UnitDatabase] Successfully initialized UnitDatabase
[2025-03-12 00:05:20] [INFO] [UnitDatabase] Finished initializing UnitDatabase
[2025-03-12 00:05:20] [INFO] [JsonDatabase] Started initializing JsonDatabase
[2025-03-12 00:05:20] [INFO] [JsonTable] Started initializing JsonTable
[2025-03-12 00:05:20] [INFO] [JsonTable] Successfully initialized JsonTable
[2025-03-12 00:05:20] [INFO] [JsonTable] Finished initializing JsonTable
[2025-03-12 00:05:20] [INFO] [JsonTable] Started initializing JsonTable
[2025-03-12 00:05:20] [INFO] [JsonTable] Successfully initialized JsonTable
[2025-03-12 00:05:20] [INFO] [JsonTable] Finished initializing JsonTable
[2025-03-12 00:05:20] [INFO] [JsonTable] Started initializing JsonTable
[2025-03-12 00:05:20] [INFO] [JsonTable] Successfully initialized JsonTable
[2025-03-12 00:05:20] [INFO] [JsonTable] Finished initializing JsonTable
[2025-03-12 00:05:20] [INFO] [JsonDatabase] Successfully initialized JsonDatabase
[2025-03-12 00:05:20] [INFO] [JsonDatabase] Finished initializing JsonDatabase
[2025-03-12 00:05:20] [INFO] [Component] Setting 4a18ce19-aa66-46c0-9905-9b6a796c6f85 on to c7b78c8b-f4de-4333-a454-16b4796b781c.
[2025-03-12 00:05:20] [INFO] [SpeedQueue] Added unit enemy:Quleu into queue
[2025-03-12 00:05:20] [INFO] [Component] Setting 0756c07c-4b4f-496c-b95d-127c0c0d8bed on to 81f35502-e758-491f-ac7a-b19e67947dae.
[2025-03-12 00:05:20] [INFO] [SpeedQueue] Added unit enemy:Wore into queue
[2025-03-12 00:05:20] [INFO] [Component] Setting 4c19c3a2-5136-4661-b9aa-46a10b1d49d7 on to 54dafce9-0e92-4871-9c6f-e8739fd1833a.
[2025-03-12 00:05:20] [INFO] [SpeedQueue] Added unit enemy:Kydfiq into queue
[2025-03-12 00:05:20] [INFO] [Component] Setting ba354dbd-3e2d-4eb4-a227-9525766a1d56 on to 4314c346-6d3e-4a92-9d66-b0d2f21f61ce.
[2025-03-12 00:05:20] [INFO] [SpeedQueue] Added unit user:Wyuuoi into queue
[2025-03-12 00:05:20] [INFO] [Component] Setting 27774ed1-db1c-4b61-a515-ba52a7b12dbf on to fc2f67ab-0189-4e94-b908-5c19acb24869.
[2025-03-12 00:05:20] [INFO] [SpeedQueue] Added unit user:Vixo into queue
[2025-03-12 00:05:20] [INFO] [Component] Setting e82204dd-db35-41d3-bf2a-a1dfbbc57fc7 on to 9a190ab1-dae3-4e35-a387-ccf1bd0ebcc3.
[2025-03-12 00:05:20] [INFO] [SpeedQueue] Added unit user:Seieo into queue
[2025-03-12 00:05:20] [INFO] [Component] Setting ba22475f-5ad6-4d9a-9c5e-8ed2807f7711 on to 930605c9-cab5-4990-96e7-6e6876e20c64.
[2025-03-12 00:05:20] [INFO] [SpeedQueue] Added unit user:Ioje into queue
[2025-03-12 00:05:20] [INFO] [FontPool] Started initializing FontPool
[2025-03-12 00:05:20] [INFO] [FontPool] ✅ Successfully loaded font: Lilian
[2025-03-12 00:05:21] [INFO] [SpeedQueue] Speed queue updated.
[2025-03-12 00:05:21] [INFO] [VisualsSystem] Started creating blurred background
[2025-03-12 00:05:21] [INFO] [TimeLinePanel] Started updating the timeline panel after turn order has changed.
[2025-03-12 00:05:21] [INFO] [TimeLinePanel] Finished updating the timeline panel after turn order has changed.
[2025-03-12 00:05:21] [INFO] [SelectedTilePanel] Checksum updated, getting units at selected tiles.
[2025-03-12 00:05:21] [INFO] [SelectedTilePanel] Either no unit selected or more than one unit selected
[2025-03-12 00:05:21] [INFO] [LesserStatisticsInformationPanel] Checksum has been updated, querying statistics for unit e82204dd-db35-41d3-bf2a-a1dfbbc57fc7
[2025-03-12 00:05:21] [INFO] [VisualsSystem] Finished creating blurred background after 0.5066208243370056 seconds
[2025-03-12 00:05:23] [INFO] [SelectedTilePanel] Checksum updated, getting units at selected tiles.
[2025-03-12 00:05:23] [INFO] [SelectedTilePanel] Updated selected tile display to view Kydfiq
[2025-03-12 00:05:23] [INFO] [LesserStatisticsInformationPanel] Finished updating Greater UI
[2025-03-12 00:14:10] [INFO] [SelectedTilePanel] Checksum updated, getting units at selected tiles.
[2025-03-12 00:14:10] [INFO] [SelectedTilePanel] Updated selected tile display to view Seieo
[2025-03-12 00:14:10] [INFO] [LesserStatisticsInformationPanel] Finished updating Greater UI
[2025-03-12 00:14:11] [INFO] [MovementSystem] Seieo is planning to move from [8, 3] to null
[2025-03-12 00:14:11] [INFO] [MovementSystem] Updated movement area for Seieo
[2025-03-12 00:14:11] [INFO] [MovementSystem] Updated movement path for Seieo
[2025-03-12 00:14:12] [INFO] [MovementSystem] Seieo is planning to move from [8, 3] to [9, 3]
[2025-03-12 00:14:12] [INFO] [MovementSystem] Updated movement path for Seieo
[2025-03-12 00:14:12] [INFO] [MovementSystem] Seieo is planning to move from [8, 3] to [9, 2]
[2025-03-12 00:14:12] [INFO] [MovementSystem] Updated movement path for Seieo
[2025-03-12 00:14:12] [INFO] [MovementSystem] Seieo is planning to move from [8, 3] to [8, 2]
[2025-03-12 00:14:12] [INFO] [MovementSystem] Updated movement path for Seieo
[2025-03-12 00:14:13] [INFO] [Component] Setting e82204dd-db35-41d3-bf2a-a1dfbbc57fc7 on to a7b6890b-9c8e-49da-8733-d1e51d0317e5.
[2025-03-12 00:14:13] [INFO] [MovementSystem] Moved from [8, 3] to [8, 2]
[2025-03-12 00:14:13] [INFO] [SelectedTilePanel] Checksum updated, getting units at selected tiles.
[2025-03-12 00:14:13] [INFO] [SelectedTilePanel] Updated selected tile display to view Seieo
[2025-03-12 00:14:13] [INFO] [LesserStatisticsInformationPanel] Finished updating Greater UI
[2025-03-12 00:14:19] [INFO] [AbilitySelectionPanel] Selecting slam
[2025-03-12 00:14:19] [INFO] [AbilityDatabase] Started initializing AbilityDatabase
[2025-03-12 00:14:19] [INFO] [AbilityDatabase] Successfully initialized AbilityDatabase
[2025-03-12 00:14:19] [INFO] [AbilityDatabase] Finished initializing AbilityDatabase
[2025-03-12 00:14:19] [INFO] [AbilitySystem] Seieo is planning to use slam on null
[2025-03-12 00:14:19] [INFO] [AbilitySystem] Updated area of sight for Seieo, viewing 5 tiles
[2025-03-12 00:14:19] [INFO] [AbilitySystem] Updated line of sight for Seieo, viewing 0 tiles
[2025-03-12 00:14:19] [INFO] [AbilitySystem] Updated area of effect for Seieo viewing 0 tiles
[2025-03-12 00:14:20] [INFO] [AbilitySystem] Seieo is planning to use slam on [9, 4]
[2025-03-12 00:14:20] [INFO] [AbilitySystem] Updated line of sight for Seieo, viewing 4 tiles
[2025-03-12 00:14:20] [INFO] [AbilitySystem] Updated area of effect for Seieo viewing 1 tiles
[2025-03-12 00:14:20] [INFO] [AbilitySystem] Seieo is planning to use slam on [9, 3]
[2025-03-12 00:14:20] [INFO] [AbilitySystem] Updated line of sight for Seieo, viewing 3 tiles
[2025-03-12 00:14:20] [INFO] [AbilitySystem] Updated area of effect for Seieo viewing 1 tiles
[2025-03-12 00:14:20] [INFO] [AbilitySystem] Seieo is planning to use slam on [9, 2]
[2025-03-12 00:14:20] [INFO] [AbilitySystem] Updated line of sight for Seieo, viewing 2 tiles
[2025-03-12 00:14:20] [INFO] [AbilitySystem] Updated area of effect for Seieo viewing 1 tiles
[2025-03-12 00:14:20] [INFO] [AbilitySystem] Seieo is planning to use slam on [8, 2]
[2025-03-12 00:14:20] [INFO] [AbilitySystem] Updated line of sight for Seieo, viewing 1 tiles
[2025-03-12 00:14:20] [INFO] [AbilitySystem] Updated area of effect for Seieo viewing 1 tiles
[2025-03-12 00:14:20] [INFO] [AbilitySystem] Seieo is planning to use slam on [8, 1]
[2025-03-12 00:14:20] [INFO] [AbilitySystem] Updated line of sight for Seieo, viewing 2 tiles
[2025-03-12 00:14:20] [INFO] [AbilitySystem] Updated area of effect for Seieo viewing 1 tiles
[2025-03-12 00:14:21] [INFO] [AbilitySystem] Used from slam on [8, 1]
[2025-03-12 00:14:23] [INFO] [TimeLinePanel] Started updating the timeline panel after turn order has changed.
[2025-03-12 00:14:23] [INFO] [TimeLinePanel] Finished updating the timeline panel after turn order has changed.
[2025-03-12 00:14:23] [INFO] [MovementSystem] Wore is planning to move from [8, 1] to [9, 1]
[2025-03-12 00:14:23] [INFO] [MovementSystem] Updated movement area for Wore
[2025-03-12 00:14:23] [INFO] [MovementSystem] Updated movement path for Wore
[2025-03-12 00:14:23] [INFO] [Component] Setting 0756c07c-4b4f-496c-b95d-127c0c0d8bed on to 5ab2edd7-2129-4e96-9dab-0990cf7a2bd9.
[2025-03-12 00:14:23] [INFO] [MovementSystem] Moved from [8, 1] to [9, 1]
[2025-03-12 00:14:27] [INFO] [TimeLinePanel] Started updating the timeline panel after turn order has changed.
[2025-03-12 00:14:27] [INFO] [TimeLinePanel] Finished updating the timeline panel after turn order has changed.
[2025-03-12 00:14:28] [INFO] [MovementSystem] Wyuuoi is planning to move from [9, 5] to null
[2025-03-12 00:14:28] [INFO] [MovementSystem] Updated movement area for Wyuuoi
[2025-03-12 00:14:28] [INFO] [MovementSystem] Updated movement path for Wyuuoi
[2025-03-12 00:14:29] [INFO] [MovementSystem] Wyuuoi is planning to move from [9, 5] to [9, 3]
[2025-03-12 00:14:29] [INFO] [MovementSystem] Updated movement path for Wyuuoi
[2025-03-12 00:14:29] [INFO] [MovementSystem] Wyuuoi is planning to move from [9, 5] to [9, 2]
[2025-03-12 00:14:29] [INFO] [MovementSystem] Updated movement path for Wyuuoi
[2025-03-12 00:14:29] [INFO] [MovementSystem] Wyuuoi is planning to move from [9, 5] to [9, 3]
[2025-03-12 00:14:29] [INFO] [MovementSystem] Updated movement path for Wyuuoi
[2025-03-12 00:14:31] [INFO] [Component] Setting ba354dbd-3e2d-4eb4-a227-9525766a1d56 on to ab5532d4-b145-4565-9ae8-24a9cac1ccd0.
[2025-03-12 00:14:31] [INFO] [MovementSystem] Moved from [9, 5] to [9, 3]
[2025-03-12 00:14:31] [INFO] [SelectedTilePanel] Checksum updated, getting units at selected tiles.
[2025-03-12 00:14:31] [INFO] [SelectedTilePanel] Updated selected tile display to view Wyuuoi
[2025-03-12 00:14:31] [INFO] [LesserStatisticsInformationPanel] Finished updating Greater UI
[2025-03-12 00:14:34] [INFO] [AbilitySelectionPanel] Selecting energy_beam
[2025-03-12 00:14:34] [INFO] [AbilitySystem] Wyuuoi is planning to use energy_beam on null
[2025-03-12 00:14:34] [INFO] [AbilitySystem] Updated area of sight for Wyuuoi, viewing 9 tiles
[2025-03-12 00:14:34] [INFO] [AbilitySystem] Updated line of sight for Wyuuoi, viewing 0 tiles
[2025-03-12 00:14:34] [INFO] [AbilitySystem] Updated area of effect for Wyuuoi viewing 0 tiles
[2025-03-12 00:14:35] [INFO] [AbilitySystem] Wyuuoi is planning to use energy_beam on [9, 4]
[2025-03-12 00:14:35] [INFO] [AbilitySystem] Updated line of sight for Wyuuoi, viewing 2 tiles
[2025-03-12 00:14:35] [INFO] [AbilitySystem] Updated area of effect for Wyuuoi viewing 1 tiles
[2025-03-12 00:14:35] [INFO] [AbilitySystem] Wyuuoi is planning to use energy_beam on [9, 3]
[2025-03-12 00:14:35] [INFO] [AbilitySystem] Updated line of sight for Wyuuoi, viewing 1 tiles
[2025-03-12 00:14:35] [INFO] [AbilitySystem] Updated area of effect for Wyuuoi viewing 1 tiles
[2025-03-12 00:14:35] [INFO] [AbilitySystem] Wyuuoi is planning to use energy_beam on [9, 2]
[2025-03-12 00:14:35] [INFO] [AbilitySystem] Updated line of sight for Wyuuoi, viewing 2 tiles
[2025-03-12 00:14:35] [INFO] [AbilitySystem] Updated area of effect for Wyuuoi viewing 1 tiles
[2025-03-12 00:14:35] [INFO] [AbilitySystem] Wyuuoi is planning to use energy_beam on [8, 2]
[2025-03-12 00:14:35] [INFO] [AbilitySystem] Updated line of sight for Wyuuoi, viewing 3 tiles
[2025-03-12 00:14:35] [INFO] [AbilitySystem] Updated area of effect for Wyuuoi viewing 1 tiles
[2025-03-12 00:14:36] [INFO] [AbilitySystem] Used from energy_beam on [8, 2]
[2025-03-12 00:14:38] [INFO] [TimeLinePanel] Started updating the timeline panel after turn order has changed.
[2025-03-12 00:14:38] [INFO] [TimeLinePanel] Finished updating the timeline panel after turn order has changed.
[2025-03-12 00:14:39] [INFO] [SelectedTilePanel] Checksum updated, getting units at selected tiles.
[2025-03-12 00:14:39] [INFO] [SelectedTilePanel] Updated selected tile display to view Seieo
[2025-03-12 00:14:39] [INFO] [LesserStatisticsInformationPanel] Finished updating Greater UI
[2025-03-12 00:14:40] [INFO] [SelectedTilePanel] Checksum updated, getting units at selected tiles.
[2025-03-12 00:14:40] [INFO] [SelectedTilePanel] Updated selected tile display to view Wyuuoi
[2025-03-12 00:14:40] [INFO] [LesserStatisticsInformationPanel] Finished updating Greater UI
[2025-03-12 00:14:41] [INFO] [SelectedTilePanel] Checksum updated, getting units at selected tiles.
[2025-03-12 00:14:41] [INFO] [SelectedTilePanel] Either no unit selected or more than one unit selected
[2025-03-12 00:14:42] [INFO] [SelectedTilePanel] Checksum updated, getting units at selected tiles.
[2025-03-12 00:14:42] [INFO] [SelectedTilePanel] Updated selected tile display to view Seieo
[2025-03-12 00:14:42] [INFO] [LesserStatisticsInformationPanel] Finished updating Greater UI
[2025-03-12 00:14:46] [INFO] [Main] {
  "map.generation.zoom": 0.75,
  "map.generation.min.height": -10,
  "hovered.tiles": ["2311c802-c2e5-4bc3-9ebc-2676c9196712"],
  "view_sprite_height": 96,
  "delta_time": 0.016207625,
  "map.generation.starting.camerra.height": 950,
  "spawn.placement.policy": "everywhere",
  "gameplay.water.level": 0,
  "statistics.panel.is.open": false,
  "automatically.go.to.home.controls": false,
  "camera_map": {
    "main_camera": {},
    "selection_camera": {}
  },
  "map.generation.starting.y": 0,
  "map.generation.base.level": 1,
  "map.generation.starting.x": 0,
  "show.heights": true,
  "hide.gameplay.ui": true,
  "tile.to.glide.to": "",
  "map.generation.max.height": 10,
  "selected.tiles.checksum": 1628599429,
  "map.generation.base.terrain": "sand_dark_floor",
  "debug_mode_for_the_game_state": false,
  "movement.panel.is.open": false,
  "gameplay.rows": 10,
  "view_sprite_width": 96,
  "map.generation.starting.sprite.width": 96,
  "ability.panel.is.open": false,
  "gameplay.mode": "gameplay.mode.regular",
  "map.generation.structure.assets": ["tree4_structure"],
  "floating_text_map": {},
  "map.center.on.startup": true,
  "gameplay.columns": 10,
  "gameplay.water.asset": "water_liquid",
  "selected.tiles": ["a7b6890b-9c8e-49da-8733-d1e51d0317e5"],
  "map.generation.starting.camera.width": 1500,
  "should.end.the.turn": false,
  "selected_ability_from_ui": "",
  "map.generation.starting.sprite.height": 96,
  "map.generation.use.noise": true,
  "floating_text_font_size": 30,
  "map.generation.base.asset": "base_floor"
}
