[2025-03-15 09:44:03] [INFO] [AssetPool] Started initializing AssetPool
[2025-03-15 09:44:03] [INFO] [Engine] HEAP ALLOCATION INCREASED! 1.0 GB of 16.0 GB used
[2025-03-15 09:44:03] [INFO] [SpriteSheetOG] Started loading Sprite's from ./res/graphics
[2025-03-15 09:44:03] [INFO] [SpriteSheetOG] Finished reading files for sprites
[2025-03-15 09:44:03] [INFO] [Sprite] Finished loading ./res/graphics/misc/blue_reticle.png
[2025-03-15 09:44:03] [INFO] [Sprite] Finished loading ./res/graphics/misc/pink_spawn.png
[2025-03-15 09:44:03] [INFO] [Sprite] Finished loading ./res/graphics/misc/reticle.png
[2025-03-15 09:44:03] [INFO] [Sprite] Finished loading ./res/graphics/misc/yellow_spawn.png
[2025-03-15 09:44:03] [INFO] [Sprite] Finished loading ./res/graphics/misc/blue_spawn.png
[2025-03-15 09:44:03] [INFO] [Sprite] Finished loading ./res/graphics/misc/red_reticle.png
[2025-03-15 09:44:03] [INFO] [Sprite] Finished loading ./res/graphics/misc/depth_shadows.png
[2025-03-15 09:44:03] [INFO] [Sprite] Finished loading ./res/graphics/misc/yellow_reticle.png
[2025-03-15 09:44:03] [INFO] [Sprite] Finished loading ./res/graphics/misc/red_spawn.png
[2025-03-15 09:44:03] [INFO] [Sprite] Finished loading ./res/graphics/misc/directional_shadows.png
[2025-03-15 09:44:03] [INFO] [Sprite] Finished loading ./res/graphics/shadows/northwest.png
[2025-03-15 09:44:03] [INFO] [Sprite] Finished loading ./res/graphics/shadows/west.png
[2025-03-15 09:44:03] [INFO] [Sprite] Finished loading ./res/graphics/shadows/north.png
[2025-03-15 09:44:03] [INFO] [Sprite] Finished loading ./res/graphics/shadows/east.png
[2025-03-15 09:44:03] [INFO] [Sprite] Finished loading ./res/graphics/shadows/northeast.png
[2025-03-15 09:44:03] [INFO] [Sprite] Finished loading ./res/graphics/shadows/south.png
[2025-03-15 09:44:03] [INFO] [Sprite] Finished loading ./res/graphics/shadows/southwest.png
[2025-03-15 09:44:03] [INFO] [Sprite] Finished loading ./res/graphics/shadows/southeast.png
[2025-03-15 09:44:03] [INFO] [Sprite] Finished loading ./res/graphics/structures/tree3_structure.png
[2025-03-15 09:44:03] [INFO] [Sprite] Finished loading ./res/graphics/structures/tree4_structure.png
[2025-03-15 09:44:03] [INFO] [Sprite] Finished loading ./res/graphics/structures/tree1_structure.png
[2025-03-15 09:44:03] [INFO] [Sprite] Finished loading ./res/graphics/structures/tree5_structure.png
[2025-03-15 09:44:03] [INFO] [Sprite] Finished loading ./res/graphics/structures/tree2_structure.png
[2025-03-15 09:44:03] [INFO] [Sprite] Finished loading ./res/graphics/structures/tree6_structure.png
[2025-03-15 09:44:03] [INFO] [Sprite] Finished loading ./res/graphics/wall_tiles/rock_wall2.png
[2025-03-15 09:44:03] [INFO] [Sprite] Finished loading ./res/graphics/wall_tiles/sandstone_wall.png
[2025-03-15 09:44:03] [INFO] [Sprite] Finished loading ./res/graphics/wall_tiles/elden_yellow_wall.png
[2025-03-15 09:44:03] [INFO] [Sprite] Finished loading ./res/graphics/wall_tiles/vine_on_wall.png
[2025-03-15 09:44:03] [INFO] [Sprite] Finished loading ./res/graphics/wall_tiles/boulder_wall.png
[2025-03-15 09:44:03] [INFO] [Sprite] Finished loading ./res/graphics/wall_tiles/white_marble_wall.png
[2025-03-15 09:44:03] [INFO] [Sprite] Finished loading ./res/graphics/wall_tiles/elden_green_wall.png
[2025-03-15 09:44:03] [INFO] [Sprite] Finished loading ./res/graphics/wall_tiles/brown_marble_wall.png
[2025-03-15 09:44:03] [INFO] [Sprite] Finished loading ./res/graphics/wall_tiles/small_brick_wall.png
[2025-03-15 09:44:03] [INFO] [Sprite] Finished loading ./res/graphics/wall_tiles/moss_wall.png
[2025-03-15 09:44:03] [INFO] [Sprite] Finished loading ./res/graphics/wall_tiles/dirt_brick_vine_wall.png
[2025-03-15 09:44:03] [INFO] [Sprite] Finished loading ./res/graphics/wall_tiles/elden_purple_wall.png
[2025-03-15 09:44:03] [INFO] [Sprite] Finished loading ./res/graphics/wall_tiles/large_brick_wall.png
[2025-03-15 09:44:03] [INFO] [Sprite] Finished loading ./res/graphics/wall_tiles/dirt_wall.png
[2025-03-15 09:44:03] [INFO] [Sprite] Finished loading ./res/graphics/wall_tiles/alien_wall.png
[2025-03-15 09:44:03] [INFO] [Sprite] Finished loading ./res/graphics/wall_tiles/industrial_brick_wall.png
[2025-03-15 09:44:03] [INFO] [Sprite] Finished loading ./res/graphics/wall_tiles/rock_wall.png
[2025-03-15 09:44:03] [INFO] [Sprite] Finished loading ./res/graphics/wall_tiles/dirt_wall2.png
[2025-03-15 09:44:03] [INFO] [Sprite] Finished loading ./res/graphics/wall_tiles/moss_wall2.png
[2025-03-15 09:44:03] [INFO] [Sprite] Finished loading ./res/graphics/wall_tiles/moss_wall3.png
[2025-03-15 09:44:03] [INFO] [Sprite] Finished loading ./res/graphics/wall_tiles/no_wall.png
[2025-03-15 09:44:03] [INFO] [Sprite] Finished loading ./res/graphics/wall_tiles/alien_rune_wall.png
[2025-03-15 09:44:03] [INFO] [Sprite] Finished loading ./res/graphics/wall_tiles/industrial_wall.png
[2025-03-15 09:44:03] [INFO] [Sprite] Finished loading ./res/graphics/wall_tiles/small_brick_wall2.png
[2025-03-15 09:44:03] [INFO] [Sprite] Finished loading ./res/graphics/old/liquids 2.png
[2025-03-15 09:44:03] [INFO] [Sprite] Finished loading ./res/graphics/old/gems.png
[2025-03-15 09:44:03] [INFO] [Sprite] Finished loading ./res/graphics/old/floors.png
[2025-03-15 09:44:03] [INFO] [Sprite] Finished loading ./res/graphics/old/terrains.png
[2025-03-15 09:44:03] [INFO] [Sprite] Finished loading ./res/graphics/old/gemsRaw.png
[2025-03-15 09:44:03] [INFO] [Sprite] Finished loading ./res/graphics/old/walls.png
[2025-03-15 09:44:03] [INFO] [Sprite] Finished loading ./res/graphics/old/special2.png
[2025-03-15 09:44:03] [INFO] [Sprite] Finished loading ./res/graphics/old/structures.png
[2025-03-15 09:44:03] [INFO] [Sprite] Finished loading ./res/graphics/old/special.png
[2025-03-15 09:44:03] [INFO] [Sprite] Finished loading ./res/graphics/old/liquids.png
[2025-03-15 09:44:03] [INFO] [Sprite] Finished loading ./res/graphics/old/units.png
[2025-03-15 09:44:03] [INFO] [Sprite] Finished loading ./res/graphics/old/terrains2.png
[2025-03-15 09:44:03] [INFO] [Sprite] Finished loading ./res/graphics/old/floors2.png
[2025-03-15 09:44:03] [INFO] [Sprite] Finished loading ./res/graphics/floor_tiles/sand_1_floor.png
[2025-03-15 09:44:03] [INFO] [Sprite] Finished loading ./res/graphics/floor_tiles/sand_dark_floor.png
[2025-03-15 09:44:03] [INFO] [Sprite] Finished loading ./res/graphics/floor_tiles/dirty_grass_1_floor.png
[2025-03-15 09:44:03] [INFO] [Sprite] Finished loading ./res/graphics/floor_tiles/white_sand_floor.png
[2025-03-15 09:44:03] [INFO] [Sprite] Finished loading ./res/graphics/floor_tiles/white_sands_2.png
[2025-03-15 09:44:03] [INFO] [Sprite] Finished loading ./res/graphics/floor_tiles/dirty_grass_2_floor.png
[2025-03-15 09:44:03] [INFO] [Sprite] Finished loading ./res/graphics/floor_tiles/sand_3_floor.png
[2025-03-15 09:44:03] [INFO] [Sprite] Finished loading ./res/graphics/floor_tiles/obsidian_floor.png
[2025-03-15 09:44:03] [INFO] [Sprite] Finished loading ./res/graphics/floor_tiles/base_floor.png
[2025-03-15 09:44:03] [INFO] [Sprite] Finished loading ./res/graphics/floor_tiles/sand_floor.png
[2025-03-15 09:44:03] [INFO] [Sprite] Finished loading ./res/graphics/floor_tiles/dirty_grass_3_floor.png
[2025-03-15 09:44:03] [INFO] [Sprite] Finished loading ./res/graphics/floor_tiles/sand_2_floor.png
[2025-03-15 09:44:03] [INFO] [Sprite] Finished loading ./res/graphics/units/Air_Dragon.png
[2025-03-15 09:44:03] [INFO] [Sprite] Finished loading ./res/graphics/units/Dragon.png
[2025-03-15 09:44:03] [INFO] [Sprite] Finished loading ./res/graphics/units/Dark_Dragon.png
[2025-03-15 09:44:03] [INFO] [Sprite] Finished loading ./res/graphics/units/Earth_Dragon.png
[2025-03-15 09:44:03] [INFO] [Sprite] Finished loading ./res/graphics/units/Light_Dragon.png
[2025-03-15 09:44:03] [INFO] [Sprite] Finished loading ./res/graphics/units/Water_Dragon.png
[2025-03-15 09:44:03] [INFO] [Sprite] Finished loading ./res/graphics/units/Fire_Dragon.png
[2025-03-15 09:44:03] [INFO] [Sprite] Finished loading ./res/graphics/actions/StatsDown.png
[2025-03-15 09:44:03] [INFO] [Sprite] Finished loading ./res/graphics/actions/PhysicalHit4.png
[2025-03-15 09:44:03] [INFO] [Sprite] Finished loading ./res/graphics/actions/Slash.png
[2025-03-15 09:44:03] [INFO] [Sprite] Finished loading ./res/graphics/actions/Air.png
[2025-03-15 09:44:03] [INFO] [Sprite] Finished loading ./res/graphics/actions/Dark.png
[2025-03-15 09:44:03] [INFO] [Sprite] Finished loading ./res/graphics/actions/Blunt.png
[2025-03-15 09:44:03] [INFO] [Sprite] Finished loading ./res/graphics/actions/Fire.png
[2025-03-15 09:44:03] [INFO] [Sprite] Finished loading ./res/graphics/actions/Earth.png
[2025-03-15 09:44:03] [INFO] [Sprite] Finished loading ./res/graphics/actions/Light.png
[2025-03-15 09:44:03] [INFO] [Sprite] Finished loading ./res/graphics/actions/StatsUp.png
[2025-03-15 09:44:03] [INFO] [Sprite] Finished loading ./res/graphics/actions/Water.png
[2025-03-15 09:44:03] [INFO] [Sprite] Finished loading ./res/graphics/actions/Pierce.png
[2025-03-15 09:44:03] [INFO] [Sprite] Finished loading ./res/graphics/spells/LightSpell.png
[2025-03-15 09:44:03] [INFO] [Sprite] Finished loading ./res/graphics/spells/StatsDown.png
[2025-03-15 09:44:03] [INFO] [Sprite] Finished loading ./res/graphics/spells/WindSpell.png
[2025-03-15 09:44:03] [INFO] [Sprite] Finished loading ./res/graphics/spells/WaterSpell.png
[2025-03-15 09:44:03] [INFO] [Sprite] Finished loading ./res/graphics/spells/PhysicalHit4.png
[2025-03-15 09:44:03] [INFO] [Sprite] Finished loading ./res/graphics/spells/PhysicalHit1.png
[2025-03-15 09:44:03] [INFO] [Sprite] Finished loading ./res/graphics/spells/LightningSpell.png
[2025-03-15 09:44:03] [INFO] [Sprite] Finished loading ./res/graphics/spells/PhysicalHit3.png
[2025-03-15 09:44:03] [INFO] [Sprite] Finished loading ./res/graphics/spells/PhysicalHit2.png
[2025-03-15 09:44:03] [INFO] [Sprite] Finished loading ./res/graphics/spells/FireSpell.png
[2025-03-15 09:44:03] [INFO] [Sprite] Finished loading ./res/graphics/spells/DarkSpell.png
[2025-03-15 09:44:03] [INFO] [Sprite] Finished loading ./res/graphics/spells/StatsUp.png
[2025-03-15 09:44:03] [INFO] [Sprite] Finished loading ./res/graphics/spells/EarthSpell.png
[2025-03-15 09:44:03] [INFO] [Sprite] Finished loading ./res/graphics/liquids/greater_leafage_liquid.png
[2025-03-15 09:44:03] [INFO] [Sprite] Finished loading ./res/graphics/liquids/waterV4_liquid.png
[2025-03-15 09:44:03] [INFO] [Sprite] Finished loading ./res/graphics/liquids/shallow_swamp.png
[2025-03-15 09:44:03] [INFO] [Sprite] Finished loading ./res/graphics/liquids/water5.png
[2025-03-15 09:44:03] [INFO] [Sprite] Finished loading ./res/graphics/liquids/swamp_2.png
[2025-03-15 09:44:03] [INFO] [Sprite] Finished loading ./res/graphics/liquids/Lava_liquid.png
[2025-03-15 09:44:03] [INFO] [Sprite] Finished loading ./res/graphics/liquids/swamp2.png
[2025-03-15 09:44:03] [INFO] [Sprite] Finished loading ./res/graphics/liquids/waterV33_liquid.png
[2025-03-15 09:44:03] [INFO] [Sprite] Finished loading ./res/graphics/liquids/shallow_water_liquid.png
[2025-03-15 09:44:03] [INFO] [Sprite] Finished loading ./res/graphics/liquids/water_liquid.png
[2025-03-15 09:44:03] [INFO] [Sprite] Finished loading ./res/graphics/liquids/waterV2_liquid.png
[2025-03-15 09:44:03] [INFO] [Sprite] Finished loading ./res/graphics/liquids/swamp2_liquid.png
[2025-03-15 09:44:03] [INFO] [SpriteSheetOG] Finished loading ./res/graphics
[2025-03-15 09:44:03] [INFO] [AssetPool] Finished initializing AssetPool
[2025-03-15 09:44:03] [INFO] [FontPoolV1] Started initializing FontPoolV1
[2025-03-15 09:44:04] [INFO] [FontPoolV1] Finished initializing FontPoolV1
[2025-03-15 09:44:04] [INFO] [UnitDatabase] Started initializing UnitDatabase
[2025-03-15 09:44:04] [INFO] [UnitDatabase] Successfully initialized UnitDatabase
[2025-03-15 09:44:04] [INFO] [UnitDatabase] Finished initializing UnitDatabase
[2025-03-15 09:44:04] [INFO] [JsonDatabase] Started initializing JsonDatabase
[2025-03-15 09:44:04] [INFO] [JsonTable] Started initializing JsonTable
[2025-03-15 09:44:04] [INFO] [JsonTable] Successfully initialized JsonTable
[2025-03-15 09:44:04] [INFO] [JsonTable] Finished initializing JsonTable
[2025-03-15 09:44:04] [INFO] [JsonTable] Started initializing JsonTable
[2025-03-15 09:44:04] [INFO] [JsonTable] Successfully initialized JsonTable
[2025-03-15 09:44:04] [INFO] [JsonTable] Finished initializing JsonTable
[2025-03-15 09:44:04] [INFO] [JsonTable] Started initializing JsonTable
[2025-03-15 09:44:04] [INFO] [JsonTable] Successfully initialized JsonTable
[2025-03-15 09:44:04] [INFO] [JsonTable] Finished initializing JsonTable
[2025-03-15 09:44:04] [INFO] [JsonDatabase] Successfully initialized JsonDatabase
[2025-03-15 09:44:04] [INFO] [JsonDatabase] Finished initializing JsonDatabase
[2025-03-15 09:44:04] [INFO] [Component] Setting e5a830d0-470e-46b1-90d6-d0f8ef2f1213 on to 84894c32-0bea-4337-9d3d-ecd8336acde9.
[2025-03-15 09:44:04] [INFO] [SpeedQueue] Added unit enemy:Zobp into queue
[2025-03-15 09:44:04] [INFO] [Component] Setting 8e73278a-0784-466c-9181-394576da8d21 on to b49f617d-dfa1-4346-a5e4-35b9d54205de.
[2025-03-15 09:44:04] [INFO] [SpeedQueue] Added unit enemy:Qyrsha into queue
[2025-03-15 09:44:04] [INFO] [Component] Setting 89345c22-46ee-43ce-8228-63e7b0b4e920 on to 372156f4-14c8-44fa-8340-922015e8caba.
[2025-03-15 09:44:04] [INFO] [SpeedQueue] Added unit enemy:Yalff into queue
[2025-03-15 09:44:04] [INFO] [Component] Setting 3b4bb06e-307b-4561-9972-7e5b7893784b on to dd898ace-6175-429e-96c9-159b556cbb62.
[2025-03-15 09:44:04] [INFO] [SpeedQueue] Added unit enemy:Rogy into queue
[2025-03-15 09:44:04] [INFO] [Component] Setting a812c3e8-de3d-4dc8-983a-f95c0fbd7ddb on to 81d9715a-b7ab-43d5-8994-07594a01cdfb.
[2025-03-15 09:44:04] [INFO] [SpeedQueue] Added unit user:Zilgu into queue
[2025-03-15 09:44:04] [INFO] [Component] Setting 51b45e9b-6fe7-4cc2-98a7-058c899a8ced on to 5adeb53b-dd32-4332-9b4d-dbc4d019e86e.
[2025-03-15 09:44:04] [INFO] [SpeedQueue] Added unit user:Gowo into queue
[2025-03-15 09:44:04] [INFO] [Component] Setting b9f94c4f-b70b-4f5c-b44e-638f5b98ec8b on to ec1be485-532c-4a33-8395-ee881d9d404a.
[2025-03-15 09:44:04] [INFO] [SpeedQueue] Added unit user:Jasoi into queue
[2025-03-15 09:44:04] [INFO] [Component] Setting 7916448c-59d5-4d2b-bb13-43736e4f8b43 on to f95391c2-70fb-4e6f-918f-b257fcb9b7b7.
[2025-03-15 09:44:04] [INFO] [SpeedQueue] Added unit user:Oiqywy into queue
[2025-03-15 09:44:04] [INFO] [FontPool] Started initializing FontPool
[2025-03-15 09:44:04] [INFO] [FontPool] ✅ Successfully loaded font: Lilian
[2025-03-15 09:44:05] [INFO] [SpeedQueue] Speed queue updated.
[2025-03-15 09:44:05] [INFO] [VisualsSystem] Started creating blurred background
[2025-03-15 09:44:05] [INFO] [TimeLinePanel] Started updating the timeline panel after turn order has changed.
[2025-03-15 09:44:05] [INFO] [TimeLinePanel] Finished updating the timeline panel after turn order has changed.
[2025-03-15 09:44:05] [INFO] [SelectedTilePanel] Checksum updated, getting units at selected tiles.
[2025-03-15 09:44:05] [INFO] [SelectedTilePanel] Either no unit selected or more than one unit selected
[2025-03-15 09:44:05] [INFO] [LesserStatisticsInformationPanel] Checksum has been updated, querying statistics for unit 8e73278a-0784-466c-9181-394576da8d21
[2025-03-15 09:44:05] [INFO] [VisualsSystem] Finished creating blurred background after 0.49780192971229553 seconds
[2025-03-15 09:44:06] [INFO] [AbilityDatabase] Started initializing AbilityDatabase
[2025-03-15 09:44:06] [INFO] [AbilityDatabase] Successfully initialized AbilityDatabase
[2025-03-15 09:44:06] [INFO] [AbilityDatabase] Finished initializing AbilityDatabase
[2025-03-15 09:44:07] [INFO] [SelectedTilePanel] Checksum updated, getting units at selected tiles.
[2025-03-15 09:44:07] [INFO] [SelectedTilePanel] Updated selected tile display to view Qyrsha
[2025-03-15 09:44:07] [INFO] [LesserStatisticsInformationPanel] Finished updating Greater UI
[2025-03-15 09:44:08] [INFO] [MovementSystem] Qyrsha is planning to move from [2, 0] to [4, 0]
[2025-03-15 09:44:08] [INFO] [MovementSystem] Updated movement area for Qyrsha
[2025-03-15 09:44:08] [INFO] [MovementSystem] Updated movement path for Qyrsha
[2025-03-15 09:44:08] [INFO] [Component] Setting 8e73278a-0784-466c-9181-394576da8d21 on to 14f16b6e-6d5d-4972-8f60-c7f2b52e3484.
[2025-03-15 09:44:08] [INFO] [MovementSystem] Moved from [2, 0] to [4, 0]
[2025-03-15 09:44:08] [INFO] [SelectedTilePanel] Checksum updated, getting units at selected tiles.
[2025-03-15 09:44:08] [INFO] [SelectedTilePanel] Either no unit selected or more than one unit selected
[2025-03-15 09:44:09] [INFO] [SelectedTilePanel] Checksum updated, getting units at selected tiles.
[2025-03-15 09:44:09] [INFO] [SelectedTilePanel] Either no unit selected or more than one unit selected
[2025-03-15 09:44:10] [INFO] [TimeLinePanel] Started updating the timeline panel after turn order has changed.
[2025-03-15 09:44:10] [INFO] [TimeLinePanel] Finished updating the timeline panel after turn order has changed.
[2025-03-15 09:44:10] [INFO] [MovementSystem] Zobp is planning to move from [2, 8] to [1, 9]
[2025-03-15 09:44:10] [INFO] [MovementSystem] Updated movement area for Zobp
[2025-03-15 09:44:10] [INFO] [MovementSystem] Updated movement path for Zobp
[2025-03-15 09:44:10] [INFO] [Component] Setting e5a830d0-470e-46b1-90d6-d0f8ef2f1213 on to 043126a1-bd27-45f6-acb8-6492d0ebd509.
[2025-03-15 09:44:10] [INFO] [MovementSystem] Moved from [2, 8] to [1, 9]
[2025-03-15 09:44:14] [INFO] [TimeLinePanel] Started updating the timeline panel after turn order has changed.
[2025-03-15 09:44:14] [INFO] [TimeLinePanel] Finished updating the timeline panel after turn order has changed.
[2025-03-15 09:44:14] [INFO] [SelectedTilePanel] Checksum updated, getting units at selected tiles.
[2025-03-15 09:44:14] [INFO] [SelectedTilePanel] Updated selected tile display to view Jasoi
[2025-03-15 09:44:14] [INFO] [LesserStatisticsInformationPanel] Finished updating Greater UI
[2025-03-15 09:44:18] [INFO] [AbilitySelectionPanel] Selecting energy_beam
[2025-03-15 09:44:18] [INFO] [AbilitySystem] Jasoi is planning to use energy_beam on [6, 6]
[2025-03-15 09:44:18] [INFO] [AbilitySystem] Updated area of sight for Jasoi, viewing 13 tiles
[2025-03-15 09:44:18] [INFO] [AbilitySystem] Updated line of sight for Jasoi, viewing 7 tiles
[2025-03-15 09:44:18] [INFO] [AbilitySystem] Updated area of effect for Jasoi viewing 1 tiles
[2025-03-15 09:44:18] [INFO] [AbilitySystem] Jasoi is planning to use energy_beam on [7, 6]
[2025-03-15 09:44:18] [INFO] [AbilitySystem] Updated line of sight for Jasoi, viewing 8 tiles
[2025-03-15 09:44:18] [INFO] [AbilitySystem] Updated area of effect for Jasoi viewing 1 tiles
[2025-03-15 09:44:18] [INFO] [AbilitySystem] Jasoi is planning to use energy_beam on [6, 5]
[2025-03-15 09:44:18] [INFO] [AbilitySystem] Updated line of sight for Jasoi, viewing 6 tiles
[2025-03-15 09:44:18] [INFO] [AbilitySystem] Updated area of effect for Jasoi viewing 1 tiles
[2025-03-15 09:44:18] [INFO] [AbilitySystem] Jasoi is planning to use energy_beam on [6, 4]
[2025-03-15 09:44:18] [INFO] [AbilitySystem] Updated line of sight for Jasoi, viewing 5 tiles
[2025-03-15 09:44:18] [INFO] [AbilitySystem] Updated area of effect for Jasoi viewing 1 tiles
[2025-03-15 09:44:18] [INFO] [AbilitySystem] Jasoi is planning to use energy_beam on [5, 3]
[2025-03-15 09:44:18] [INFO] [AbilitySystem] Updated line of sight for Jasoi, viewing 3 tiles
[2025-03-15 09:44:18] [INFO] [AbilitySystem] Updated area of effect for Jasoi viewing 1 tiles
[2025-03-15 09:44:18] [INFO] [AbilitySystem] Jasoi is planning to use energy_beam on [5, 2]
[2025-03-15 09:44:18] [INFO] [AbilitySystem] Updated line of sight for Jasoi, viewing 2 tiles
[2025-03-15 09:44:18] [INFO] [AbilitySystem] Updated area of effect for Jasoi viewing 1 tiles
[2025-03-15 09:44:18] [INFO] [AbilitySystem] Jasoi is planning to use energy_beam on [4, 2]
[2025-03-15 09:44:18] [INFO] [AbilitySystem] Updated line of sight for Jasoi, viewing 1 tiles
[2025-03-15 09:44:18] [INFO] [AbilitySystem] Updated area of effect for Jasoi viewing 1 tiles
[2025-03-15 09:44:18] [INFO] [AbilitySystem] Jasoi is planning to use energy_beam on [4, 1]
[2025-03-15 09:44:18] [INFO] [AbilitySystem] Updated line of sight for Jasoi, viewing 2 tiles
[2025-03-15 09:44:18] [INFO] [AbilitySystem] Updated area of effect for Jasoi viewing 1 tiles
[2025-03-15 09:44:18] [INFO] [AbilitySystem] Jasoi is planning to use energy_beam on [4, 0]
[2025-03-15 09:44:18] [INFO] [AbilitySystem] Updated line of sight for Jasoi, viewing 3 tiles
[2025-03-15 09:44:18] [INFO] [AbilitySystem] Updated area of effect for Jasoi viewing 1 tiles
[2025-03-15 09:44:19] [INFO] [AbilitySystem] Used from energy_beam on [4, 0]
[2025-03-15 09:44:24] [INFO] [Main] {
  "map.generation.zoom": 0.75,
  "map.generation.min.height": -10,
  "hovered.tiles": ["11916220-13d0-441c-9290-4ef33f1f1369"],
  "view_sprite_height": 96,
  "delta_time": 0.017394292,
  "map.generation.starting.camerra.height": 950,
  "spawn.placement.policy": "everywhere",
  "gameplay.water.level": 0,
  "statistics.panel.is.open": false,
  "automatically.go.to.home.controls": false,
  "camera_map": {
    "main_camera": {},
    "selection_camera": {}
  },
  "map.generation.starting.y": 0,
  "map.generation.base.level": 1,
  "map.generation.starting.x": 0,
  "show.heights": true,
  "hide.gameplay.ui": true,
  "tile.to.glide.to": "",
  "map.generation.max.height": 10,
  "selected.tiles.checksum": 408642863,
  "map.generation.base.terrain": "dirty_grass_1_floor",
  "debug_mode_for_the_game_state": false,
  "movement.panel.is.open": false,
  "gameplay.rows": 10,
  "view_sprite_width": 96,
  "map.generation.starting.sprite.width": 96,
  "ability.panel.is.open": false,
  "gameplay.mode": "gameplay.mode.regular",
  "map.generation.structure.assets": ["tree4_structure"],
  "floating_text_map": {},
  "map.center.on.startup": true,
  "gameplay.columns": 10,
  "gameplay.water.asset": "water_liquid",
  "selected.tiles": ["ec1be485-532c-4a33-8395-ee881d9d404a"],
  "map.generation.starting.camera.width": 1500,
  "should.end.the.turn": false,
  "selected_ability_from_ui": "",
  "map.generation.starting.sprite.height": 96,
  "map.generation.use.noise": true,
  "floating_text_font_size": 30,
  "map.generation.base.asset": "base_floor"
}
