[2025-03-14 22:46:36] [INFO] [AssetPool] Started initializing AssetPool
[2025-03-14 22:46:36] [INFO] [Engine] HEAP ALLOCATION INCREASED! 1.0 GB of 16.0 GB used
[2025-03-14 22:46:36] [INFO] [SpriteSheetOG] Started loading Sprite's from ./res/graphics
[2025-03-14 22:46:36] [INFO] [SpriteSheetOG] Finished reading files for sprites
[2025-03-14 22:46:36] [INFO] [Sprite] Finished loading ./res/graphics/misc/blue_reticle.png
[2025-03-14 22:46:36] [INFO] [Sprite] Finished loading ./res/graphics/misc/pink_spawn.png
[2025-03-14 22:46:36] [INFO] [Sprite] Finished loading ./res/graphics/misc/reticle.png
[2025-03-14 22:46:36] [INFO] [Sprite] Finished loading ./res/graphics/misc/yellow_spawn.png
[2025-03-14 22:46:36] [INFO] [Sprite] Finished loading ./res/graphics/misc/blue_spawn.png
[2025-03-14 22:46:36] [INFO] [Sprite] Finished loading ./res/graphics/misc/red_reticle.png
[2025-03-14 22:46:36] [INFO] [Sprite] Finished loading ./res/graphics/misc/depth_shadows.png
[2025-03-14 22:46:36] [INFO] [Sprite] Finished loading ./res/graphics/misc/yellow_reticle.png
[2025-03-14 22:46:36] [INFO] [Sprite] Finished loading ./res/graphics/misc/red_spawn.png
[2025-03-14 22:46:36] [INFO] [Sprite] Finished loading ./res/graphics/misc/directional_shadows.png
[2025-03-14 22:46:36] [INFO] [Sprite] Finished loading ./res/graphics/shadows/northwest.png
[2025-03-14 22:46:36] [INFO] [Sprite] Finished loading ./res/graphics/shadows/west.png
[2025-03-14 22:46:36] [INFO] [Sprite] Finished loading ./res/graphics/shadows/north.png
[2025-03-14 22:46:36] [INFO] [Sprite] Finished loading ./res/graphics/shadows/east.png
[2025-03-14 22:46:36] [INFO] [Sprite] Finished loading ./res/graphics/shadows/northeast.png
[2025-03-14 22:46:36] [INFO] [Sprite] Finished loading ./res/graphics/shadows/south.png
[2025-03-14 22:46:36] [INFO] [Sprite] Finished loading ./res/graphics/shadows/southwest.png
[2025-03-14 22:46:36] [INFO] [Sprite] Finished loading ./res/graphics/shadows/southeast.png
[2025-03-14 22:46:36] [INFO] [Sprite] Finished loading ./res/graphics/structures/tree3_structure.png
[2025-03-14 22:46:36] [INFO] [Sprite] Finished loading ./res/graphics/structures/tree4_structure.png
[2025-03-14 22:46:36] [INFO] [Sprite] Finished loading ./res/graphics/structures/tree1_structure.png
[2025-03-14 22:46:36] [INFO] [Sprite] Finished loading ./res/graphics/structures/tree5_structure.png
[2025-03-14 22:46:36] [INFO] [Sprite] Finished loading ./res/graphics/structures/tree2_structure.png
[2025-03-14 22:46:36] [INFO] [Sprite] Finished loading ./res/graphics/structures/tree6_structure.png
[2025-03-14 22:46:36] [INFO] [Sprite] Finished loading ./res/graphics/wall_tiles/rock_wall2.png
[2025-03-14 22:46:36] [INFO] [Sprite] Finished loading ./res/graphics/wall_tiles/sandstone_wall.png
[2025-03-14 22:46:36] [INFO] [Sprite] Finished loading ./res/graphics/wall_tiles/elden_yellow_wall.png
[2025-03-14 22:46:36] [INFO] [Sprite] Finished loading ./res/graphics/wall_tiles/vine_on_wall.png
[2025-03-14 22:46:36] [INFO] [Sprite] Finished loading ./res/graphics/wall_tiles/boulder_wall.png
[2025-03-14 22:46:36] [INFO] [Sprite] Finished loading ./res/graphics/wall_tiles/white_marble_wall.png
[2025-03-14 22:46:36] [INFO] [Sprite] Finished loading ./res/graphics/wall_tiles/elden_green_wall.png
[2025-03-14 22:46:36] [INFO] [Sprite] Finished loading ./res/graphics/wall_tiles/brown_marble_wall.png
[2025-03-14 22:46:36] [INFO] [Sprite] Finished loading ./res/graphics/wall_tiles/small_brick_wall.png
[2025-03-14 22:46:36] [INFO] [Sprite] Finished loading ./res/graphics/wall_tiles/moss_wall.png
[2025-03-14 22:46:36] [INFO] [Sprite] Finished loading ./res/graphics/wall_tiles/dirt_brick_vine_wall.png
[2025-03-14 22:46:36] [INFO] [Sprite] Finished loading ./res/graphics/wall_tiles/elden_purple_wall.png
[2025-03-14 22:46:36] [INFO] [Sprite] Finished loading ./res/graphics/wall_tiles/large_brick_wall.png
[2025-03-14 22:46:36] [INFO] [Sprite] Finished loading ./res/graphics/wall_tiles/dirt_wall.png
[2025-03-14 22:46:36] [INFO] [Sprite] Finished loading ./res/graphics/wall_tiles/alien_wall.png
[2025-03-14 22:46:36] [INFO] [Sprite] Finished loading ./res/graphics/wall_tiles/industrial_brick_wall.png
[2025-03-14 22:46:36] [INFO] [Sprite] Finished loading ./res/graphics/wall_tiles/rock_wall.png
[2025-03-14 22:46:36] [INFO] [Sprite] Finished loading ./res/graphics/wall_tiles/dirt_wall2.png
[2025-03-14 22:46:36] [INFO] [Sprite] Finished loading ./res/graphics/wall_tiles/moss_wall2.png
[2025-03-14 22:46:36] [INFO] [Sprite] Finished loading ./res/graphics/wall_tiles/moss_wall3.png
[2025-03-14 22:46:36] [INFO] [Sprite] Finished loading ./res/graphics/wall_tiles/no_wall.png
[2025-03-14 22:46:36] [INFO] [Sprite] Finished loading ./res/graphics/wall_tiles/alien_rune_wall.png
[2025-03-14 22:46:36] [INFO] [Sprite] Finished loading ./res/graphics/wall_tiles/industrial_wall.png
[2025-03-14 22:46:36] [INFO] [Sprite] Finished loading ./res/graphics/wall_tiles/small_brick_wall2.png
[2025-03-14 22:46:36] [INFO] [Sprite] Finished loading ./res/graphics/old/liquids 2.png
[2025-03-14 22:46:36] [INFO] [Sprite] Finished loading ./res/graphics/old/gems.png
[2025-03-14 22:46:36] [INFO] [Sprite] Finished loading ./res/graphics/old/floors.png
[2025-03-14 22:46:36] [INFO] [Sprite] Finished loading ./res/graphics/old/terrains.png
[2025-03-14 22:46:36] [INFO] [Sprite] Finished loading ./res/graphics/old/gemsRaw.png
[2025-03-14 22:46:36] [INFO] [Sprite] Finished loading ./res/graphics/old/walls.png
[2025-03-14 22:46:36] [INFO] [Sprite] Finished loading ./res/graphics/old/special2.png
[2025-03-14 22:46:36] [INFO] [Sprite] Finished loading ./res/graphics/old/structures.png
[2025-03-14 22:46:36] [INFO] [Sprite] Finished loading ./res/graphics/old/special.png
[2025-03-14 22:46:36] [INFO] [Sprite] Finished loading ./res/graphics/old/liquids.png
[2025-03-14 22:46:36] [INFO] [Sprite] Finished loading ./res/graphics/old/units.png
[2025-03-14 22:46:36] [INFO] [Sprite] Finished loading ./res/graphics/old/terrains2.png
[2025-03-14 22:46:36] [INFO] [Sprite] Finished loading ./res/graphics/old/floors2.png
[2025-03-14 22:46:36] [INFO] [Sprite] Finished loading ./res/graphics/floor_tiles/sand_1_floor.png
[2025-03-14 22:46:36] [INFO] [Sprite] Finished loading ./res/graphics/floor_tiles/sand_dark_floor.png
[2025-03-14 22:46:36] [INFO] [Sprite] Finished loading ./res/graphics/floor_tiles/dirty_grass_1_floor.png
[2025-03-14 22:46:36] [INFO] [Sprite] Finished loading ./res/graphics/floor_tiles/white_sand_floor.png
[2025-03-14 22:46:36] [INFO] [Sprite] Finished loading ./res/graphics/floor_tiles/white_sands_2.png
[2025-03-14 22:46:36] [INFO] [Sprite] Finished loading ./res/graphics/floor_tiles/dirty_grass_2_floor.png
[2025-03-14 22:46:36] [INFO] [Sprite] Finished loading ./res/graphics/floor_tiles/sand_3_floor.png
[2025-03-14 22:46:36] [INFO] [Sprite] Finished loading ./res/graphics/floor_tiles/obsidian_floor.png
[2025-03-14 22:46:36] [INFO] [Sprite] Finished loading ./res/graphics/floor_tiles/base_floor.png
[2025-03-14 22:46:36] [INFO] [Sprite] Finished loading ./res/graphics/floor_tiles/sand_floor.png
[2025-03-14 22:46:36] [INFO] [Sprite] Finished loading ./res/graphics/floor_tiles/dirty_grass_3_floor.png
[2025-03-14 22:46:36] [INFO] [Sprite] Finished loading ./res/graphics/floor_tiles/sand_2_floor.png
[2025-03-14 22:46:36] [INFO] [Sprite] Finished loading ./res/graphics/units/Air_Dragon.png
[2025-03-14 22:46:36] [INFO] [Sprite] Finished loading ./res/graphics/units/Dragon.png
[2025-03-14 22:46:36] [INFO] [Sprite] Finished loading ./res/graphics/units/Dark_Dragon.png
[2025-03-14 22:46:36] [INFO] [Sprite] Finished loading ./res/graphics/units/Earth_Dragon.png
[2025-03-14 22:46:36] [INFO] [Sprite] Finished loading ./res/graphics/units/Light_Dragon.png
[2025-03-14 22:46:36] [INFO] [Sprite] Finished loading ./res/graphics/units/Water_Dragon.png
[2025-03-14 22:46:36] [INFO] [Sprite] Finished loading ./res/graphics/units/Fire_Dragon.png
[2025-03-14 22:46:36] [INFO] [Sprite] Finished loading ./res/graphics/actions/StatsDown.png
[2025-03-14 22:46:36] [INFO] [Sprite] Finished loading ./res/graphics/actions/PhysicalHit4.png
[2025-03-14 22:46:36] [INFO] [Sprite] Finished loading ./res/graphics/actions/Slash.png
[2025-03-14 22:46:36] [INFO] [Sprite] Finished loading ./res/graphics/actions/Air.png
[2025-03-14 22:46:36] [INFO] [Sprite] Finished loading ./res/graphics/actions/Dark.png
[2025-03-14 22:46:36] [INFO] [Sprite] Finished loading ./res/graphics/actions/Blunt.png
[2025-03-14 22:46:36] [INFO] [Sprite] Finished loading ./res/graphics/actions/Fire.png
[2025-03-14 22:46:36] [INFO] [Sprite] Finished loading ./res/graphics/actions/Earth.png
[2025-03-14 22:46:36] [INFO] [Sprite] Finished loading ./res/graphics/actions/Light.png
[2025-03-14 22:46:36] [INFO] [Sprite] Finished loading ./res/graphics/actions/StatsUp.png
[2025-03-14 22:46:36] [INFO] [Sprite] Finished loading ./res/graphics/actions/Water.png
[2025-03-14 22:46:36] [INFO] [Sprite] Finished loading ./res/graphics/actions/Pierce.png
[2025-03-14 22:46:36] [INFO] [Sprite] Finished loading ./res/graphics/spells/LightSpell.png
[2025-03-14 22:46:36] [INFO] [Sprite] Finished loading ./res/graphics/spells/StatsDown.png
[2025-03-14 22:46:36] [INFO] [Sprite] Finished loading ./res/graphics/spells/WindSpell.png
[2025-03-14 22:46:36] [INFO] [Sprite] Finished loading ./res/graphics/spells/WaterSpell.png
[2025-03-14 22:46:36] [INFO] [Sprite] Finished loading ./res/graphics/spells/PhysicalHit4.png
[2025-03-14 22:46:36] [INFO] [Sprite] Finished loading ./res/graphics/spells/PhysicalHit1.png
[2025-03-14 22:46:36] [INFO] [Sprite] Finished loading ./res/graphics/spells/LightningSpell.png
[2025-03-14 22:46:36] [INFO] [Sprite] Finished loading ./res/graphics/spells/PhysicalHit3.png
[2025-03-14 22:46:36] [INFO] [Sprite] Finished loading ./res/graphics/spells/PhysicalHit2.png
[2025-03-14 22:46:36] [INFO] [Sprite] Finished loading ./res/graphics/spells/FireSpell.png
[2025-03-14 22:46:36] [INFO] [Sprite] Finished loading ./res/graphics/spells/DarkSpell.png
[2025-03-14 22:46:36] [INFO] [Sprite] Finished loading ./res/graphics/spells/StatsUp.png
[2025-03-14 22:46:36] [INFO] [Sprite] Finished loading ./res/graphics/spells/EarthSpell.png
[2025-03-14 22:46:36] [INFO] [Sprite] Finished loading ./res/graphics/liquids/greater_leafage_liquid.png
[2025-03-14 22:46:36] [INFO] [Sprite] Finished loading ./res/graphics/liquids/waterV4_liquid.png
[2025-03-14 22:46:36] [INFO] [Sprite] Finished loading ./res/graphics/liquids/shallow_swamp.png
[2025-03-14 22:46:36] [INFO] [Sprite] Finished loading ./res/graphics/liquids/water5.png
[2025-03-14 22:46:36] [INFO] [Sprite] Finished loading ./res/graphics/liquids/swamp_2.png
[2025-03-14 22:46:36] [INFO] [Sprite] Finished loading ./res/graphics/liquids/Lava_liquid.png
[2025-03-14 22:46:36] [INFO] [Sprite] Finished loading ./res/graphics/liquids/swamp2.png
[2025-03-14 22:46:36] [INFO] [Sprite] Finished loading ./res/graphics/liquids/waterV33_liquid.png
[2025-03-14 22:46:36] [INFO] [Sprite] Finished loading ./res/graphics/liquids/shallow_water_liquid.png
[2025-03-14 22:46:36] [INFO] [Sprite] Finished loading ./res/graphics/liquids/water_liquid.png
[2025-03-14 22:46:36] [INFO] [Sprite] Finished loading ./res/graphics/liquids/waterV2_liquid.png
[2025-03-14 22:46:36] [INFO] [Sprite] Finished loading ./res/graphics/liquids/swamp2_liquid.png
[2025-03-14 22:46:36] [INFO] [SpriteSheetOG] Finished loading ./res/graphics
[2025-03-14 22:46:36] [INFO] [AssetPool] Finished initializing AssetPool
[2025-03-14 22:46:36] [INFO] [FontPoolV1] Started initializing FontPoolV1
[2025-03-14 22:46:36] [INFO] [FontPoolV1] Finished initializing FontPoolV1
[2025-03-14 22:46:36] [INFO] [UnitDatabase] Started initializing UnitDatabase
[2025-03-14 22:46:36] [INFO] [UnitDatabase] Successfully initialized UnitDatabase
[2025-03-14 22:46:36] [INFO] [UnitDatabase] Finished initializing UnitDatabase
[2025-03-14 22:46:36] [INFO] [JsonDatabase] Started initializing JsonDatabase
[2025-03-14 22:46:36] [INFO] [JsonTable] Started initializing JsonTable
[2025-03-14 22:46:36] [INFO] [JsonTable] Successfully initialized JsonTable
[2025-03-14 22:46:36] [INFO] [JsonTable] Finished initializing JsonTable
[2025-03-14 22:46:36] [INFO] [JsonTable] Started initializing JsonTable
[2025-03-14 22:46:36] [INFO] [JsonTable] Successfully initialized JsonTable
[2025-03-14 22:46:36] [INFO] [JsonTable] Finished initializing JsonTable
[2025-03-14 22:46:36] [INFO] [JsonTable] Started initializing JsonTable
[2025-03-14 22:46:36] [INFO] [JsonTable] Successfully initialized JsonTable
[2025-03-14 22:46:36] [INFO] [JsonTable] Finished initializing JsonTable
[2025-03-14 22:46:36] [INFO] [JsonDatabase] Successfully initialized JsonDatabase
[2025-03-14 22:46:36] [INFO] [JsonDatabase] Finished initializing JsonDatabase
[2025-03-14 22:46:36] [INFO] [Component] Setting 12f69dbf-454f-4fc0-9141-767af2e385bf on to 2e3c2136-7958-4368-87be-f997e19929bd.
[2025-03-14 22:46:36] [INFO] [SpeedQueue] Added unit enemy:Xosqeu into queue
[2025-03-14 22:46:36] [INFO] [Component] Setting 8dacfbe5-a1e0-486f-856f-c5e95a933df4 on to afe1048a-1b96-4867-8092-8902b7dcb515.
[2025-03-14 22:46:36] [INFO] [SpeedQueue] Added unit enemy:Poui into queue
[2025-03-14 22:46:36] [INFO] [Component] Setting 5c5d8c79-14d7-4a96-9729-9084fd088878 on to 51ce41d2-b3e0-44f5-a414-16678ae18191.
[2025-03-14 22:46:36] [INFO] [SpeedQueue] Added unit enemy:Hinwo into queue
[2025-03-14 22:46:36] [INFO] [Component] Setting 949031ce-715f-4618-bfc2-ca876e8dc261 on to df2b0fa4-1645-46f0-8816-01f90619af79.
[2025-03-14 22:46:36] [INFO] [SpeedQueue] Added unit enemy:Pamohy into queue
[2025-03-14 22:46:36] [INFO] [Component] Setting 3688e08f-43a0-4aff-af6b-83eb22329bdb on to b10d5d84-abda-4031-ab2b-fb88f7e51c4b.
[2025-03-14 22:46:36] [INFO] [SpeedQueue] Added unit user:Busoa into queue
[2025-03-14 22:46:36] [INFO] [Component] Setting 9c3d1f4b-75f9-4496-b5cb-a0f8d228e707 on to 61ca4216-0352-47fd-8cf9-6ce46f55ad1a.
[2025-03-14 22:46:36] [INFO] [SpeedQueue] Added unit user:Ayfeiz into queue
[2025-03-14 22:46:36] [INFO] [Component] Setting 36495fb7-2533-4e86-824c-d29908535aaf on to a7fd206d-63d1-4983-8242-b59be53b9bb4.
[2025-03-14 22:46:36] [INFO] [SpeedQueue] Added unit user:Byppuy into queue
[2025-03-14 22:46:36] [INFO] [FontPool] Started initializing FontPool
[2025-03-14 22:46:36] [INFO] [FontPool] ✅ Successfully loaded font: Lilian
[2025-03-14 22:46:37] [INFO] [SpeedQueue] Speed queue updated.
[2025-03-14 22:46:37] [INFO] [VisualsSystem] Started creating blurred background
[2025-03-14 22:46:37] [INFO] [TimeLinePanel] Started updating the timeline panel after turn order has changed.
[2025-03-14 22:46:37] [INFO] [TimeLinePanel] Finished updating the timeline panel after turn order has changed.
[2025-03-14 22:46:37] [INFO] [SelectedTilePanel] Checksum updated, getting units at selected tiles.
[2025-03-14 22:46:37] [INFO] [SelectedTilePanel] Either no unit selected or more than one unit selected
[2025-03-14 22:46:37] [INFO] [LesserStatisticsInformationPanel] Checksum has been updated, querying statistics for unit 8dacfbe5-a1e0-486f-856f-c5e95a933df4
[2025-03-14 22:46:38] [INFO] [VisualsSystem] Finished creating blurred background after 0.504357635974884 seconds
[2025-03-14 22:46:38] [INFO] [AbilityDatabase] Started initializing AbilityDatabase
[2025-03-14 22:46:38] [INFO] [AbilityDatabase] Successfully initialized AbilityDatabase
[2025-03-14 22:46:38] [INFO] [AbilityDatabase] Finished initializing AbilityDatabase
[2025-03-14 22:46:39] [INFO] [SelectedTilePanel] Checksum updated, getting units at selected tiles.
[2025-03-14 22:46:39] [INFO] [SelectedTilePanel] Updated selected tile display to view Pamohy
[2025-03-14 22:46:39] [INFO] [LesserStatisticsInformationPanel] Finished updating Greater UI
[2025-03-14 22:46:40] [INFO] [MovementSystem] Poui is planning to move from [3, 2] to [4, 3]
[2025-03-14 22:46:40] [INFO] [MovementSystem] Updated movement area for Poui
[2025-03-14 22:46:40] [INFO] [MovementSystem] Updated movement path for Poui
[2025-03-14 22:46:40] [INFO] [Component] Setting 8dacfbe5-a1e0-486f-856f-c5e95a933df4 on to 66a7ab6c-0dca-4ba0-8f2d-f41bfa353a91.
[2025-03-14 22:46:40] [INFO] [MovementSystem] Moved from [3, 2] to [4, 3]
[2025-03-14 22:46:41] [INFO] [SelectedTilePanel] Checksum updated, getting units at selected tiles.
[2025-03-14 22:46:41] [INFO] [SelectedTilePanel] Updated selected tile display to view Poui
[2025-03-14 22:46:41] [INFO] [LesserStatisticsInformationPanel] Finished updating Greater UI
[2025-03-14 22:46:42] [INFO] [TimeLinePanel] Started updating the timeline panel after turn order has changed.
[2025-03-14 22:46:42] [INFO] [TimeLinePanel] Finished updating the timeline panel after turn order has changed.
[2025-03-14 22:46:44] [INFO] [SelectedTilePanel] Checksum updated, getting units at selected tiles.
[2025-03-14 22:46:44] [INFO] [SelectedTilePanel] Updated selected tile display to view Xosqeu
[2025-03-14 22:46:44] [INFO] [LesserStatisticsInformationPanel] Finished updating Greater UI
[2025-03-14 22:46:44] [INFO] [MovementSystem] Xosqeu is planning to move from [1, 3] to [2, 4]
[2025-03-14 22:46:44] [INFO] [MovementSystem] Updated movement area for Xosqeu
[2025-03-14 22:46:44] [INFO] [MovementSystem] Updated movement path for Xosqeu
[2025-03-14 22:46:44] [INFO] [Component] Setting 12f69dbf-454f-4fc0-9141-767af2e385bf on to 3be4d2b3-df7f-4c1d-822a-fd8d012dcc1b.
[2025-03-14 22:46:44] [INFO] [MovementSystem] Moved from [1, 3] to [2, 4]
[2025-03-14 22:46:46] [INFO] [TimeLinePanel] Started updating the timeline panel after turn order has changed.
[2025-03-14 22:46:46] [INFO] [TimeLinePanel] Finished updating the timeline panel after turn order has changed.
[2025-03-14 22:46:47] [INFO] [SelectedTilePanel] Checksum updated, getting units at selected tiles.
[2025-03-14 22:46:47] [INFO] [SelectedTilePanel] Updated selected tile display to view Byppuy
[2025-03-14 22:46:47] [INFO] [LesserStatisticsInformationPanel] Finished updating Greater UI
[2025-03-14 22:46:49] [INFO] [MovementSystem] Byppuy is planning to move from [7, 7] to null
[2025-03-14 22:46:49] [INFO] [MovementSystem] Updated movement area for Byppuy
[2025-03-14 22:46:49] [INFO] [MovementSystem] Updated movement path for Byppuy
[2025-03-14 22:46:50] [INFO] [MovementSystem] Byppuy is planning to move from [7, 7] to [9, 9]
[2025-03-14 22:46:50] [INFO] [MovementSystem] Updated movement path for Byppuy
[2025-03-14 22:46:50] [INFO] [MovementSystem] Byppuy is planning to move from [7, 7] to [8, 9]
[2025-03-14 22:46:50] [INFO] [MovementSystem] Updated movement path for Byppuy
[2025-03-14 22:46:50] [INFO] [MovementSystem] Byppuy is planning to move from [7, 7] to [8, 8]
[2025-03-14 22:46:50] [INFO] [MovementSystem] Updated movement path for Byppuy
[2025-03-14 22:46:50] [INFO] [MovementSystem] Byppuy is planning to move from [7, 7] to [7, 8]
[2025-03-14 22:46:50] [INFO] [MovementSystem] Updated movement path for Byppuy
[2025-03-14 22:46:50] [INFO] [MovementSystem] Byppuy is planning to move from [7, 7] to [6, 8]
[2025-03-14 22:46:50] [INFO] [MovementSystem] Updated movement path for Byppuy
[2025-03-14 22:46:50] [INFO] [MovementSystem] Byppuy is planning to move from [7, 7] to [6, 7]
[2025-03-14 22:46:50] [INFO] [MovementSystem] Updated movement path for Byppuy
[2025-03-14 22:46:50] [INFO] [MovementSystem] Byppuy is planning to move from [7, 7] to [5, 7]
[2025-03-14 22:46:50] [INFO] [MovementSystem] Updated movement path for Byppuy
[2025-03-14 22:46:50] [INFO] [MovementSystem] Byppuy is planning to move from [7, 7] to [5, 6]
[2025-03-14 22:46:50] [INFO] [MovementSystem] Updated movement path for Byppuy
[2025-03-14 22:46:50] [INFO] [MovementSystem] Byppuy is planning to move from [7, 7] to [6, 6]
[2025-03-14 22:46:50] [INFO] [MovementSystem] Updated movement path for Byppuy
[2025-03-14 22:46:51] [INFO] [MovementSystem] Byppuy is planning to move from [7, 7] to [7, 6]
[2025-03-14 22:46:51] [INFO] [MovementSystem] Updated movement path for Byppuy
[2025-03-14 22:46:51] [INFO] [MovementSystem] Byppuy is planning to move from [7, 7] to [7, 5]
[2025-03-14 22:46:51] [INFO] [MovementSystem] Updated movement path for Byppuy
[2025-03-14 22:46:51] [INFO] [MovementSystem] Byppuy is planning to move from [7, 7] to [6, 5]
[2025-03-14 22:46:51] [INFO] [MovementSystem] Updated movement path for Byppuy
[2025-03-14 22:46:51] [INFO] [SelectedTilePanel] Checksum updated, getting units at selected tiles.
[2025-03-14 22:46:51] [INFO] [SelectedTilePanel] Either no unit selected or more than one unit selected
[2025-03-14 22:46:51] [INFO] [MovementSystem] Byppuy is planning to move from [7, 7] to [7, 5]
[2025-03-14 22:46:51] [INFO] [MovementSystem] Updated movement path for Byppuy
[2025-03-14 22:46:52] [INFO] [MovementSystem] Byppuy is planning to move from [7, 7] to [6, 5]
[2025-03-14 22:46:52] [INFO] [MovementSystem] Updated movement path for Byppuy
[2025-03-14 22:46:52] [INFO] [MovementSystem] Byppuy is planning to move from [7, 7] to [6, 6]
[2025-03-14 22:46:52] [INFO] [MovementSystem] Updated movement path for Byppuy
[2025-03-14 22:46:52] [INFO] [MovementSystem] Byppuy is planning to move from [7, 7] to [5, 6]
[2025-03-14 22:46:52] [INFO] [MovementSystem] Updated movement path for Byppuy
[2025-03-14 22:46:52] [INFO] [MovementSystem] Byppuy is planning to move from [7, 7] to [5, 7]
[2025-03-14 22:46:52] [INFO] [MovementSystem] Updated movement path for Byppuy
[2025-03-14 22:46:53] [INFO] [Component] Setting 36495fb7-2533-4e86-824c-d29908535aaf on to eff30793-c75d-4d8e-9ac8-204d03607b7b.
[2025-03-14 22:46:53] [INFO] [MovementSystem] Moved from [7, 7] to [5, 7]
[2025-03-14 22:46:53] [INFO] [SelectedTilePanel] Checksum updated, getting units at selected tiles.
[2025-03-14 22:46:53] [INFO] [SelectedTilePanel] Updated selected tile display to view Byppuy
[2025-03-14 22:46:53] [INFO] [LesserStatisticsInformationPanel] Finished updating Greater UI
[2025-03-14 22:46:54] [INFO] [TimeLinePanel] Started updating the timeline panel after turn order has changed.
[2025-03-14 22:46:54] [INFO] [TimeLinePanel] Finished updating the timeline panel after turn order has changed.
[2025-03-14 22:46:55] [INFO] [SelectedTilePanel] Checksum updated, getting units at selected tiles.
[2025-03-14 22:46:55] [INFO] [SelectedTilePanel] Updated selected tile display to view Busoa
[2025-03-14 22:46:55] [INFO] [LesserStatisticsInformationPanel] Finished updating Greater UI
[2025-03-14 22:46:57] [INFO] [MovementSystem] Busoa is planning to move from [2, 6] to null
[2025-03-14 22:46:57] [INFO] [MovementSystem] Updated movement area for Busoa
[2025-03-14 22:46:57] [INFO] [MovementSystem] Updated movement path for Busoa
[2025-03-14 22:46:58] [INFO] [MovementSystem] Busoa is planning to move from [2, 6] to [5, 9]
[2025-03-14 22:46:58] [INFO] [MovementSystem] Updated movement path for Busoa
[2025-03-14 22:46:58] [INFO] [MovementSystem] Busoa is planning to move from [2, 6] to [5, 8]
[2025-03-14 22:46:58] [INFO] [MovementSystem] Updated movement path for Busoa
[2025-03-14 22:46:58] [INFO] [MovementSystem] Busoa is planning to move from [2, 6] to [4, 7]
[2025-03-14 22:46:58] [INFO] [MovementSystem] Updated movement path for Busoa
[2025-03-14 22:46:58] [INFO] [MovementSystem] Busoa is planning to move from [2, 6] to [4, 6]
[2025-03-14 22:46:58] [INFO] [MovementSystem] Updated movement path for Busoa
[2025-03-14 22:46:58] [INFO] [MovementSystem] Busoa is planning to move from [2, 6] to [4, 5]
[2025-03-14 22:46:58] [INFO] [MovementSystem] Updated movement path for Busoa
[2025-03-14 22:46:58] [INFO] [MovementSystem] Busoa is planning to move from [2, 6] to [3, 5]
[2025-03-14 22:46:58] [INFO] [MovementSystem] Updated movement path for Busoa
[2025-03-14 22:46:59] [INFO] [Component] Setting 3688e08f-43a0-4aff-af6b-83eb22329bdb on to fb3b4c29-b193-4daa-9391-0f35fc322672.
[2025-03-14 22:46:59] [INFO] [MovementSystem] Moved from [2, 6] to [3, 5]
[2025-03-14 22:46:59] [INFO] [SelectedTilePanel] Checksum updated, getting units at selected tiles.
[2025-03-14 22:46:59] [INFO] [SelectedTilePanel] Updated selected tile display to view Busoa
[2025-03-14 22:46:59] [INFO] [LesserStatisticsInformationPanel] Finished updating Greater UI
[2025-03-14 22:47:01] [INFO] [AbilitySelectionPanel] Selecting slam
[2025-03-14 22:47:01] [INFO] [AbilitySystem] Busoa is planning to use slam on null
[2025-03-14 22:47:01] [INFO] [AbilitySystem] Updated area of sight for Busoa, viewing 5 tiles
[2025-03-14 22:47:01] [INFO] [AbilitySystem] Updated line of sight for Busoa, viewing 0 tiles
[2025-03-14 22:47:01] [INFO] [AbilitySystem] Updated area of effect for Busoa viewing 0 tiles
[2025-03-14 22:47:01] [INFO] [AbilitySystem] Busoa is planning to use slam on [5, 9]
[2025-03-14 22:47:01] [INFO] [AbilitySystem] Updated line of sight for Busoa, viewing 2 tiles
[2025-03-14 22:47:01] [INFO] [AbilitySystem] Updated area of effect for Busoa viewing 1 tiles
[2025-03-14 22:47:01] [INFO] [AbilitySystem] Busoa is planning to use slam on [5, 8]
[2025-03-14 22:47:01] [INFO] [AbilitySystem] Updated line of sight for Busoa, viewing 2 tiles
[2025-03-14 22:47:01] [INFO] [AbilitySystem] Updated area of effect for Busoa viewing 1 tiles
[2025-03-14 22:47:01] [INFO] [AbilitySystem] Busoa is planning to use slam on [5, 7]
[2025-03-14 22:47:01] [INFO] [AbilitySystem] Updated line of sight for Busoa, viewing 4 tiles
[2025-03-14 22:47:01] [INFO] [AbilitySystem] Updated area of effect for Busoa viewing 1 tiles
[2025-03-14 22:47:01] [INFO] [AbilitySystem] Busoa is planning to use slam on [5, 6]
[2025-03-14 22:47:01] [INFO] [AbilitySystem] Updated line of sight for Busoa, viewing 4 tiles
[2025-03-14 22:47:01] [INFO] [AbilitySystem] Updated area of effect for Busoa viewing 1 tiles
[2025-03-14 22:47:01] [INFO] [AbilitySystem] Busoa is planning to use slam on [5, 5]
[2025-03-14 22:47:01] [INFO] [AbilitySystem] Updated line of sight for Busoa, viewing 3 tiles
[2025-03-14 22:47:01] [INFO] [AbilitySystem] Updated area of effect for Busoa viewing 1 tiles
[2025-03-14 22:47:01] [INFO] [AbilitySystem] Busoa is planning to use slam on [4, 5]
[2025-03-14 22:47:01] [INFO] [AbilitySystem] Updated line of sight for Busoa, viewing 2 tiles
[2025-03-14 22:47:01] [INFO] [AbilitySystem] Updated area of effect for Busoa viewing 1 tiles
[2025-03-14 22:47:01] [INFO] [AbilitySystem] Busoa is planning to use slam on [4, 4]
[2025-03-14 22:47:01] [INFO] [AbilitySystem] Updated line of sight for Busoa, viewing 3 tiles
[2025-03-14 22:47:01] [INFO] [AbilitySystem] Updated area of effect for Busoa viewing 1 tiles
[2025-03-14 22:47:01] [INFO] [AbilitySystem] Busoa is planning to use slam on [3, 4]
[2025-03-14 22:47:01] [INFO] [AbilitySystem] Updated line of sight for Busoa, viewing 2 tiles
[2025-03-14 22:47:01] [INFO] [AbilitySystem] Updated area of effect for Busoa viewing 1 tiles
[2025-03-14 22:47:02] [INFO] [AbilitySystem] Used from slam on [3, 4]
[2025-03-14 22:47:04] [INFO] [SelectedTilePanel] Checksum updated, getting units at selected tiles.
[2025-03-14 22:47:04] [INFO] [SelectedTilePanel] Updated selected tile display to view Ayfeiz
[2025-03-14 22:47:04] [INFO] [LesserStatisticsInformationPanel] Finished updating Greater UI
[2025-03-14 22:47:04] [INFO] [TimeLinePanel] Started updating the timeline panel after turn order has changed.
[2025-03-14 22:47:04] [INFO] [TimeLinePanel] Finished updating the timeline panel after turn order has changed.
[2025-03-14 22:47:04] [INFO] [MovementSystem] Hinwo is planning to move from [3, 9] to [4, 8]
[2025-03-14 22:47:04] [INFO] [MovementSystem] Updated movement area for Hinwo
[2025-03-14 22:47:04] [INFO] [MovementSystem] Updated movement path for Hinwo
[2025-03-14 22:47:04] [INFO] [Component] Setting 5c5d8c79-14d7-4a96-9729-9084fd088878 on to 477cc173-d8ce-4244-bd79-32b9ac81ab33.
[2025-03-14 22:47:04] [INFO] [MovementSystem] Moved from [3, 9] to [4, 8]
[2025-03-14 22:47:05] [INFO] [SelectedTilePanel] Checksum updated, getting units at selected tiles.
[2025-03-14 22:47:05] [INFO] [SelectedTilePanel] Updated selected tile display to view Busoa
[2025-03-14 22:47:05] [INFO] [LesserStatisticsInformationPanel] Finished updating Greater UI
[2025-03-14 22:47:08] [INFO] [TimeLinePanel] Started updating the timeline panel after turn order has changed.
[2025-03-14 22:47:08] [INFO] [TimeLinePanel] Finished updating the timeline panel after turn order has changed.
[2025-03-14 22:47:33] [INFO] [Main] {
  "map.generation.zoom": 0.75,
  "map.generation.min.height": -10,
  "hovered.tiles": ["559397a1-8f91-4fe1-a948-337b3f6c0731"],
  "view_sprite_height": 96,
  "delta_time": 0.016222875,
  "map.generation.starting.camerra.height": 950,
  "spawn.placement.policy": "everywhere",
  "gameplay.water.level": 0,
  "statistics.panel.is.open": false,
  "automatically.go.to.home.controls": false,
  "camera_map": {
    "main_camera": {},
    "selection_camera": {}
  },
  "map.generation.starting.y": 0,
  "map.generation.base.level": 1,
  "map.generation.starting.x": 0,
  "show.heights": true,
  "hide.gameplay.ui": true,
  "tile.to.glide.to": "",
  "map.generation.max.height": 10,
  "selected.tiles.checksum": -2047344302,
  "map.generation.base.terrain": "sand_3_floor",
  "debug_mode_for_the_game_state": false,
  "movement.panel.is.open": false,
  "gameplay.rows": 10,
  "view_sprite_width": 96,
  "map.generation.starting.sprite.width": 96,
  "ability.panel.is.open": false,
  "gameplay.mode": "gameplay.mode.regular",
  "map.generation.structure.assets": ["tree4_structure"],
  "floating_text_map": {},
  "map.center.on.startup": true,
  "gameplay.columns": 10,
  "gameplay.water.asset": "water_liquid",
  "selected.tiles": ["fb3b4c29-b193-4daa-9391-0f35fc322672"],
  "map.generation.starting.camera.width": 1500,
  "should.end.the.turn": false,
  "selected_ability_from_ui": "",
  "map.generation.starting.sprite.height": 96,
  "map.generation.use.noise": true,
  "floating_text_font_size": 30,
  "map.generation.base.asset": "base_floor"
}
